(Parent) ASIN,(Child) ASIN,Title,SKU,Sessions - Total,Sessions - Total - B2B,Session Percentage - Total,Session Percentage - Total - B2B,Page Views - Total,Page Views - Total - B2B,Page Views Percentage - Total,Page Views Percentage - Total - B2B,Featured Offer Percentage,Featured Offer Percentage - B2B,Units Ordered,Units Ordered - B2B,Unit Session Percentage,Unit Session Percentage - B2B,Ordered Product Sales,Ordered Product Sales - B2B,Total Order Items,Total Order Items - B2B
B09G393ZCR,B09G393ZCR,TREEMAISON Vastu Copper Strip | Width- 0.5 Inch | Thickness - 0.3mm | Length- 8 Feet Approx | Zone Balancing | Vastu Copper Strip for Toilet Correction | Copper Strip for Vastu | Pack of 1,COPPER-STRIP-0.5-ST1,"2,867",147,3.52%,4.55%,"4,268",250,3.57%,5.19%,99.51%,100.00%,546,28,19.04%,19.05%,"₹1,62,955.00","₹8,372.00",403,19
B0FKZ72QKH,B0FKZ72QKH,"TREE MAISON CORONATING HOMES Vastu Shakti Chakra | 7 Inch | Featuring 45 Devtas, 16 Attributes, Health Chart, for vaastu Shashtra Remedy (Acrylic)",7-INCH-SHAKTI-CHAKRA-04,"2,496",92,3.06%,2.84%,"4,577",180,3.83%,3.74%,99.73%,100.00%,291,9,11.66%,9.78%,"₹78,400.00","₹2,391.00",287,9
B0CDH7HYGR,B0CDH7HYGR,TREE MAISON CORONATING HOMES Vastu Red Tape | Size - 3 Inch (72 mm) Approx | Length- 20 Meter (Approx) | Vastu Tape for Toilet Correction | Vastu Tape for Main Door | Tape Remedy | Pack of 1,3-INCH-TAPE-RED-ST-1,717,35,0.88%,1.08%,"1,012",46,0.85%,0.96%,99.78%,100.00%,168,6,23.43%,17.14%,"₹44,255.00","₹1,590.00",148,6
B0CR5YYNL2,B0CR5YYNL2,"TREE MAISON CORONATING HOMES Copper Strip | 1 INCH | Pack of 1 | Vastu Copper Strip for Toilet | Vastu Strip Remedy | Width-25mm, Thickness-0.2mm, Length- 4 Feet Approx",4FEET-STRIP-1INCH-COPPER-SET-1,870,66,1.07%,2.04%,"1,364",102,1.14%,2.12%,99.83%,100.00%,193,13,22.18%,19.70%,"₹54,528.00","₹3,692.00",120,8
B0DGXH1GHV,B0DGXH1GHV,TREE MAISON CORONATING HOMES Selenite Seven Chakra Crystal Charging Plate | 3 Inch Approx | Selenite Plate to Charge Reiki Crystal | Spiritual Gifts for Healing,7CHAKRA-SQUARE-SELENITE-PLATE-3INCH,842,16,1.03%,0.49%,"1,235",20,1.03%,0.42%,99.55%,100.00%,114,3,13.54%,18.75%,"₹33,488.00",₹897.00,103,2
B09G9STLDT,B09G9STLDT,TREEMAISON Vastu Arylic Shakti Chakra | Size- 6 Inch | Vastu Remedy | Vastu Dosh | Vastu Chakra Remedy | Shakti Chakra for Vastu,VASTU-SHAKTI-CHAKRA-03,"3,989",134,4.89%,4.14%,"5,875",223,4.92%,4.63%,99.55%,99.29%,114,31,2.86%,23.13%,"₹30,552.00","₹8,308.00",93,10
B0CMQQ9KDH,B0CMQQ9KDH,TREE MAISON CORONATING HOMES Brass Swastik (卐) Sathiya Wall Hanging Yantra | 5 Inches | Vastu Door Hanging for Najar Dosh |Weight-350gm Approx |Decorative Home Decor Symbol for Positive Vibes,BRASS-SWASTIK-ST1,896,35,1.10%,1.08%,"1,352",54,1.13%,1.12%,99.83%,100.00%,123,2,13.73%,5.71%,"₹67,817.00","₹1,098.00",85,2
B09G38FZ7G,B09G38FZ7G,"TREEMAISON CORNATING HOMES Aluminium Strip Vastu Remedy for Home Entrance, Maha Vastu Remedy for Toilet Correction and Zone (Aluminium, 8 FEET, 12MM WIDHT, 0.2MM GAUGE) (Pack of 1),",ALUMINIUM-STRIP-0.5-ST1,472,29,0.58%,0.90%,691,43,0.58%,0.89%,99.52%,100.00%,101,9,21.40%,31.03%,"₹22,927.00","₹2,043.00",79,7
B0CL2KGHJR,B0CL2KGHJR,"TREE MAISON CORONATING HOMES Vastu Shakti Chakra | 7 Inch | Featuring 45 Devtas, 16 Attributes, Health Chart, for vaastu Shashtra Remedy (Acrylic)",FBA-PLAIN-BLACK-SHAKTICHAKRA-7IN,"1,323",63,1.62%,1.95%,"2,196",105,1.84%,2.18%,93.27%,91.11%,80,3,6.05%,4.76%,"₹23,920.00",₹897.00,78,3
B092J2JT6N,B092J2JT6N,TREE MAISON CORONATING HOMES Vastu Brass Nandi Cow Statue | 810 g Weight Approx | Vastu Remedy for Home & Office | Size- 9 X 11 Cm | Nandi Idol for Pooja | Vastu Brass Nandi Bull,FBA-VASTU-NANDI-BRASS-STATUE,"1,006",46,1.23%,1.42%,"1,498",63,1.25%,1.31%,94.49%,82.50%,58,3,5.77%,6.52%,"₹93,905.00","₹4,755.00",56,3
B0CDM63JPZ,B0CDM63JPZ,"TREE MAISON CORONATING HOMES Iron Strip | 0.5 INCH | Pack of 1 | Vastu Iron Strip for Toilet | Vastu Strip Remedy | Width-12mm, Thickness-0.2mm, Length-8 Feet Approx",LW-0.5INCH-IRON-ST1,259,21,0.32%,0.65%,396,29,0.33%,0.60%,98.59%,100.00%,80,2,30.89%,9.52%,"₹18,160.00",₹454.00,56,2
B09G3B3KDV,B09G3B3KDV,"TREEMAISON Aluminium Strip | 1 INCH | Pack of 1 | Vastu Aluminium Strip for Toilet | Vastu Strip Remedy | Width-25mm, Thickness-0.3mm, Length-8 Feet Approx",NW-ALUMINIUM-STRIP-1INCH-ST1,379,14,0.46%,0.43%,617,16,0.52%,0.33%,99.63%,100.00%,65,1,17.15%,7.14%,"₹18,460.00",₹284.00,54,1
B0BHTCFVYP,B0BHTCFVYP,TREE MAISON CORONATING HOMES Brass Dowsing L Rods Pair Plastic Handle | Aura Energy Scanner | Finding Underground Water & Geopathic Stress | Reiki | Dowsing Rods | Pendulum Assorted,BRASS-L-DOWSING-ROD,"2,228",87,2.73%,2.69%,"3,282",130,2.75%,2.70%,99.92%,100.00%,54,2,2.42%,2.30%,"₹1,06,326.00","₹3,938.00",54,2
B09KXWG2QN,B09KXWG2QN,TREEMAISON Vastu Yellow Tape | Size - 1 Inch (24 mm) Approx | Length- 20 Meter (Approx) | Vastu Tape Remedy for Toilet | Vastu Tape for Main Door Entrance | Tape Remedy | Pack of 1,YELLOW-1-INCH-TAPE-ST1,205,11,0.25%,0.34%,308,22,0.26%,0.46%,99.23%,100.00%,55,3,26.83%,27.27%,"₹10,395.00",₹567.00,53,3
B09G9RP6HK,B09G9RP6HK,TREEMAISON Plastic Maha Vastu Dosh Sakti Chakra Remedy (Transparent),VASTU-SHAKTI-CHAKRA-02,683,32,0.84%,0.99%,"1,027",56,0.86%,1.16%,98.79%,100.00%,50,9,7.32%,28.13%,"₹13,132.00","₹2,412.00",49,9
B0CJMDY86H,B0CJMDY86H,TREE MAISON CORONATING HOMES Vastu Acrylic Brown Pendulum Board | Size- 6 inch | Dowsing Divination Metaphysical Message Board with Brass Pendulum (Pendulum Assorted) Spirit Board | Witch Board,BROWN-BOARD-PENDULUM-01,657,17,0.81%,0.53%,"1,005",22,0.84%,0.46%,99.88%,100.00%,48,2,7.31%,11.76%,"₹13,920.00",₹580.00,48,2
B09MJ5Z5Y7,B09MJ5Z5Y7,TREE MAISON CORONATING HOMES Vastu Brass Eagle Statue | Size-5 X 8 X 15 Cm | 550 g Weight Approx. | Home Decor Statue | Vastu Idol for Home & Office | Vastu 3D Remedy | Zonal Placement -South-WEST,BRASS-EAGLE-SET1,625,28,0.77%,0.87%,913,34,0.76%,0.71%,100.00%,100.00%,48,3,7.68%,10.71%,"₹46,330.00","₹2,995.00",47,3
B08W46X939,B08W46X939,"TREEMAISON CORONATING HOMES Vastu Blue Color Tapes, Vastu Tape (4Inch,25 Meter Approx.)",VASTU-TAPE-BIG-BLUE,160,7,0.20%,0.22%,240,10,0.20%,0.21%,100.00%,100.00%,46,1,28.75%,14.29%,"₹12,650.00",₹275.00,44,1
B0BLCBRK8X,B0BLCBRK8X,"TREE MAISON CORONATING HOMES Acrylic Vastu Shakti Chakra | Size-12 Inch | Featuring 45 Devtas,16 Attributes | Health Chart | Rajas, Sattav, Tamas for vastu Remedy | Vastu Shakti Chakra | Pack of 1",SHAKTI-CHAKRA-12-INCH-02,"1,228",54,1.51%,1.67%,"2,236",113,1.87%,2.35%,99.61%,100.00%,44,4,3.58%,7.41%,"₹30,487.00","₹2,836.00",44,4
B0DD441C3M,B0DD441C3M,TREE MAISON CORONATING HOMES Vastu Acrylic Vedic Shakti Chakra | Size - 6 Inch | Health Chart | Vastu Shakti Chakra | Grid Map | Vastu Chakra | Vastu Remedy,VASTU-VEDIC-S.C-6IN,419,8,0.51%,0.25%,743,16,0.62%,0.33%,99.48%,100.00%,45,1,10.74%,12.50%,"₹12,060.00",₹268.00,44,1
B09NSN5LP9,B09NSN5LP9,TREE MAISON CORONATING HOMES Vastu Yellow Tape | Size - 2 Inch (48 Mm) Approx | Length- 20 Meter (Approx) | Vastu Tape Remedy For Toilet | Vastu Tape For Main Door Entrance | Tape Remedy | Pack Of 1,2-INCH-VASTU-TAPE-YELLOW-ST1,140,11,0.17%,0.34%,178,13,0.15%,0.27%,98.76%,100.00%,45,3,32.14%,27.27%,"₹10,215.00",₹681.00,42,3
B0FKZ7JMVB,B0FKZ7JMVB,TREE MAISON CORONATING HOMES Selenite Charging Plate for Crystals | 3 Inch Approx | Purify & Amplify Energy | Crystal Cleansing & Recharging | Boosts Clarity & Intuition | Spiritual Gifts for Healing,3-IN-ZODIAC-ROUND-SELENITE-PLATE,262,6,0.32%,0.19%,366,6,0.31%,0.12%,99.12%,100.00%,43,0,16.41%,0.00%,"₹12,857.00",₹0.00,42,0
B0CDM3BQ1N,B0CDM3BQ1N,"TREE MAISON CORONATING HOMES Copper Strip | 0.5 INCH | Pack of 1 | Vastu Copper Strip for Toilet | Vastu Strip Remedy | Width-12mm, Thikness-0.2mm, Length-8 Feet Approx",LW-0.5INCH-COPPER-ST1,277,15,0.34%,0.46%,455,26,0.38%,0.54%,100.00%,100.00%,53,3,19.13%,20.00%,"₹15,052.00",₹852.00,40,2
B09G39RV9L,B09G39RV9L,TREEMAISON Vastu Stainless Steel Strip | Width- 0.5 Inch | Thickness - 0.3mm | Length- 8 Feet Approx | Zone Balancing |Toilet Correction | Main Entrance | Steel Strip for Vastu | Pack of 1,NW-STAINLESS-STEEL-STRIP-0.5-ST1,"1,509",34,1.85%,1.05%,"1,910",39,1.60%,0.81%,99.76%,100.00%,42,4,2.78%,11.76%,"₹10,218.00",₹967.00,37,3
B0CLVMWNW9,B0CLVMWNW9,TREE MAISON CORONATING HOMES Copper Swastik (卐) Sathiya Wall Hanging Yantra | 3 Inch | Vastu Door Hanging for Good Luck & Auspicious Energy | Decorative Home Decor Symbol for Positive Vibes,3-INCH-COPPER-SWASTIK,525,13,0.64%,0.40%,757,22,0.63%,0.46%,99.40%,100.00%,49,0,9.33%,0.00%,"₹23,177.00",₹0.00,37,0
B0CR6337JS,B0CR6337JS,TREE MAISON CORONATING HOMES Vastu Stainless Steel Strip | Width- 1 Inch | Thickness - 0.2mm | Length- 25 Feet Approx | Strip for Zone Balancing & Toilet Correction | Steel Strip for Vastu | Pack of 1,25FEET-1INCH-STRIP-S.S-SET-1,395,17,0.48%,0.53%,575,23,0.48%,0.48%,100.00%,100.00%,41,1,10.38%,5.88%,"₹23,944.00",₹584.00,37,1
B0FCFC736X,B0FCFC736X,"BRONGS Vastu Yellow Vase | Height - 37 cm | Decorative Pot for Home & Office | Feng Shui Showpiece for Positive Energy, Prosperity & Good Luck | Resin Table Decor Gift",BG-37-CM-YELLOW-VASE,398,11,0.49%,0.34%,576,14,0.48%,0.29%,100.00%,100.00%,37,4,9.30%,36.36%,"₹34,257.00","₹3,504.00",36,3
B09NPYT3X5,B09NPYT3X5,"BRONGS Vastu Brass Strip | 1 INCH | Pack of 1 | Brass Strip for Vastu | Strip for Toilet Correction | Vastu Strip Remedy | Width-25mm, Thickness-0.3mm, Length-8 Feet Approx",BRNGS-BRASS-STRIP-ST1,376,17,0.46%,0.53%,591,31,0.49%,0.64%,99.24%,100.00%,44,1,11.70%,5.88%,"₹20,894.00",₹475.00,35,1
B0CDH92WJS,B0CDH92WJS,TREE MAISON CORONATING HOMES Vastu Green Tape | 3 Inch (72 mm) Approx | Length- 20 Meter (Approx) | Tape for Vastu Correction | Tape for Toilet Correction | Pack of 1,3-INCH-TAPE-GREEN-ST-1,171,11,0.21%,0.34%,222,14,0.19%,0.29%,99.01%,88.89%,36,2,21.05%,18.18%,"₹9,275.00",₹530.00,34,2
B0CDHC9XDB,B0CDHC9XDB,TREE MAISON CORONATING HOMES Vastu Yellow Tape | Size - 3 Inch (72 mm) Approx | Length- 20 Meter (Approx) | Vastu Tape Remedy for Toilet | Vastu Tape for Main Door | Tape Remedy | Pack of 1,3-INCH-TAPE-YELLOW-ST-1,118,2,0.14%,0.06%,160,2,0.13%,0.04%,98.60%,100.00%,44,2,37.29%,100.00%,"₹11,660.00",₹530.00,34,2
B0CR6269B5,B0CR6269B5,"TREE MAISON CORONATING HOMES Brass Strip | 1 INCH | Pack of 1 | Vastu Brass Strip for Toilet | Vastu Strip Remedy | Width-25mm, Thickness-0.2mm, Length-4 Feet Approx",4FEET-STRIP-1INCH-BRASS-SET-1,218,13,0.27%,0.40%,335,24,0.28%,0.50%,99.31%,100.00%,44,0,20.18%,0.00%,"₹13,066.00",₹0.00,33,0
B0CL2K3QD2,B0CL2K3QD2,"TREE MAISON CORONATING HOMES Vastu Shakti Chakra | Size- 7 Inch | Featuring 45 Devtas, 16 Attributes, Health Chart, for vaastu Shashtra Remedy (Acrylic)",FBA-PLAIN-RED-SHAKTICHAKRA-7IN,315,11,0.39%,0.34%,465,15,0.39%,0.31%,98.14%,100.00%,32,1,10.16%,9.09%,"₹9,344.00",₹292.00,32,1
B0CR62L7H5,B0CR62L7H5,TREE MAISON CORONATING HOMES Brass Strip | Width-1 Inch | Thickness - 0.2mm | Length-12 Feet Approx | Zone Balancing |Toilet Correction | Main Entrance | Brass Strip for Vastu | Pack of 1,12FEET-1INCH-STRIP-BRASS-SET-1,243,9,0.30%,0.28%,363,12,0.30%,0.25%,100.00%,100.00%,47,2,19.34%,22.22%,"₹22,315.00",₹974.00,32,2
B0GKGVF5KY,B0GKGVF5KY,TREE MAISON CORONATING HOMES Small Brass Vaastu Owl | Size - 2.5 Inch (Approx) | Weight Of 1 Owl - 260G (Approx) | Home Decor | Feng Shui | Vastu Shastra Remedies | Owl Statue for Good Luck |Pack of 2,BRASS-2.5INCH-OWL-ST-2,410,7,0.50%,0.22%,636,11,0.53%,0.23%,100.00%,100.00%,33,0,8.05%,0.00%,"₹29,667.00",₹0.00,31,0
B09NSMPJN2,B09NSMPJN2,TREE MAISON CORONATING HOMES Vastu Red Color Tape | Size - 2 Inch| Length- 20 Meter (Approx) |Vastu Remedy For Toilet | Main Door Entrance | Tape Remedy | Pack Of 1,2-INCH-TAPE-RED-ST1,107,7,0.13%,0.22%,153,13,0.13%,0.27%,100.00%,100.00%,32,3,29.91%,42.86%,"₹6,913.00",₹669.00,30,3
B0BG1SHCKQ,B0BG1SHCKQ,"TREE MAISON CORONATING HOMES Vastu Copper 3 Layer Pyramid | Pure Copper Vastu Remedy | 3-Inch |Pyramid for Positive Energy, Health & Wealth | Vastu Dosh Remedies for Home & Office | Pack of 1",3-LAYER-PYRMD-COPPER,477,30,0.58%,0.93%,628,44,0.53%,0.91%,99.11%,100.00%,42,13,8.81%,43.33%,"₹76,926.00","₹24,925.00",30,5
B0DGXJ58YX,B0DGXJ58YX,"Tree Maison CORONATING Homes Selenite Crystal Charging Plate | 3 Inch Approx | Selenite Plate for Crystal Cleansing, Re-Energy Work, Meditation & Pooja",SHREEYANTRA-ROUND-SELENITE-PLATE-4INCH,242,5,0.30%,0.15%,331,10,0.28%,0.21%,98.96%,100.00%,37,4,15.29%,80.00%,"₹11,062.66","₹1,196.00",30,1
B08W46T48V,B08W46T48V,"TREEMAISON VASTU GREEN Tape for VASTU DOSH Remedy for Bathroom and Entrance (4 INCH X 25 Meter) CORONATING HOMES Vastu Green Color Tapes, Vastu Tape (4Inch,25 Meter Approx.)",NEW-BIG-GREEN-TAPE-ST1,153,8,0.19%,0.25%,202,8,0.17%,0.17%,100.00%,100.00%,33,1,21.57%,12.50%,"₹9,088.00",₹284.00,29,1
B0B77622F6,B0B77622F6,TREE MAISON CORONATING HOMES Vastu Combo of Five Color Tapes | Size - 3 Inch (72 mm) Approx | Length- 20 Meter (Approx) | Vastu Tape Remedy for Toilet | Vastu Tape for Main Door Entrance | Pack of 5,3-INCH-TAPE-SET-5,447,26,0.55%,0.80%,604,35,0.51%,0.73%,100.00%,100.00%,30,4,6.71%,15.38%,"₹28,870.00","₹3,796.00",29,3
B0CZHQ462W,B0CZHQ462W,"TREE MAISON CORONATING HOMES Certified Moonstone Crystal Bracelet | Natural Healing Stone | 8 mm Round Beads | Stretchable Bracelet for Men, Women, Boys, Girls",MOONSTONE-BRACELET,328,6,0.40%,0.19%,438,6,0.37%,0.12%,100.00%,100.00%,25,0,7.62%,0.00%,"₹7,100.00",₹0.00,25,0
B09LV6RHP5,B09LV6RHP5,TREEMAISON Lead (Gaa) Helix for Vastu | Size- 4 Inch | Pack of 3 | South West Zone | Vastu Remedy | Main Door Entrance | Bedroom | Toilet | Helix Vastu Dosh Remedies,3-INCH-LEAD-GAA-HELIX-ST3,121,7,0.15%,0.22%,211,15,0.18%,0.31%,99.43%,100.00%,31,1,25.62%,14.29%,"₹23,033.00",₹743.00,24,1
B0BG8NL2TK,B0BG8NL2TK,TREE MAISON CORONATING HOMES Brass Sun Face Wall Hanging | Weight - 800 Gram Approx | 6-Inch (Approx) | Pital Surya Idol for Home & Office Décor | Sun for Vastu | Sun Wall Hanging,BRASS-SUN-6INCH,546,21,0.67%,0.65%,814,32,0.68%,0.66%,100.00%,100.00%,24,0,4.40%,0.00%,"₹36,456.00",₹0.00,24,0
B0CQP9ZW7N,B0CQP9ZW7N,TREE MAISON CORONATING HOMES Brass Dowsing Rods Pair Plastic Handle | Reiki & Energy Healing | L Divining Rods | Ideal for Finding Underground Water & Geopathic Stress | Only 2 Rods,WHITE-HANDLE-ROD-ONLY,623,18,0.76%,0.56%,886,26,0.74%,0.54%,99.59%,100.00%,24,0,3.85%,0.00%,"₹41,976.00",₹0.00,23,0
B0CQYTM39S,B0CQYTM39S,TREE MAISON CORONATING HOMES Brass Swastik (卐) Sathiya Wall Hanging Yantra | 9 Inch | Vastu Door Hanging for Najar Dosh|Weight-1kg Approx | Decorative Home Decor Symbol for Positive Vibes,9INCH-BRASS-SWASTIK,442,13,0.54%,0.40%,684,17,0.57%,0.35%,100.00%,100.00%,24,1,5.43%,7.69%,"₹39,307.00","₹1,709.00",23,1
B0D9KDY6YY,B0D9KDY6YY,TREE MAISON CORONATING HOMES Vastu Combo of Five Color Tapes | Size - 4 Inch| Length- 10 Feet (Approx) | Vastu Remedy for Toilet | Main Door Entrance | Tape Remedy | Pack of 5,4-INCH-VINYL-TAPE-SET-5,176,6,0.22%,0.19%,247,8,0.21%,0.17%,100.00%,100.00%,23,0,13.07%,0.00%,"₹14,053.00",₹0.00,23,0
B0B4DGK9V7,B0B4DGK9V7,"TREE MAISON CORONATING HOMES Vastu Shakti Chakra | Size- 12 Inch | Acrylic | Featuring 45 Devtas, 16 Attributes | with Color | Health Chart | Rajas, Sattav, Tamas for vaastu Shashtra Remedy |Pack Of 1",12-INCH-SHAKTI-CHAKRA,383,15,0.47%,0.46%,616,25,0.52%,0.52%,99.15%,100.00%,23,0,6.01%,0.00%,"₹16,307.00",₹0.00,22,0
B0DSJDQ5XN,B0DSJDQ5XN,"TREE MAISON CORONATING HOMES Vastu Aluminium Virtual Rod | 12-Inch |Weight- 318gm Approx |Virtual Entry Rod for Wealth, Prosperity & Success | Size: 12 Inch x 2.2cm| Pack of 1",12IN-ALUMINIUM-VIRTUAL-ROD-ST1,650,21,0.80%,0.65%,881,30,0.74%,0.62%,100.00%,100.00%,22,3,3.38%,14.29%,"₹12,220.00","₹1,833.00",22,3
B09KXWYYGB,B09KXWYYGB,TREEMAISON Vastu Green Tape | Size - 1 Inch (24 mm) Approx | Length- 20 Meter (Approx) | Vastu Tape Remedy for Toilet | Vastu Tape for Main Door Entrance | Tape Remedy |Pack of 1,GREEN-1-INCH-TAPE-ST1,137,4,0.17%,0.12%,188,6,0.16%,0.12%,98.29%,100.00%,21,1,15.33%,25.00%,"₹3,969.00",₹189.00,21,1
B09LV79FZT,B09LV79FZT,TREEMAISON Vastu Zinc Helix for Vastu Remedy | Vastu Remedies for Toilet - Door | Zone Correction | Vastu Dosh Nivaran Remedies | Size- 4 Inch Approx | Pack of 3,ZINC-3-INCH-HELIX-ST3,352,16,0.43%,0.49%,558,22,0.47%,0.46%,98.95%,100.00%,25,0,7.10%,0.00%,"₹24,975.00",₹0.00,21,0
B09MJ5CR7Q,B09MJ5CR7Q,TREE MAISON CORONATING HOMES Brass Vaastu Owl | Size - 3.5 Inch (Approx) | Weight - 650 G (Approx) | Home Decor | Feng Shui | Vastu Shastra Remedies | Owl Statue for Good Luck,BRASS-OWL-SET1,320,13,0.39%,0.40%,399,18,0.33%,0.37%,100.00%,100.00%,30,1,9.38%,7.69%,"₹28,645.00",₹999.00,21,1
B09NSM4411,B09NSM4411,TREE MAISON CORONATING HOMES Vastu Green Tape |Size - 2 Inch | Length- 20 Meter (Approx) | Vastu Tape Remedy for Toilet | Vastu Tape for Main Door Entrance | Pack of 1,2-INCH-TAPE-GREEN-ST1,42,2,0.05%,0.06%,59,3,0.05%,0.06%,100.00%,100.00%,21,2,50.00%,100.00%,"₹4,683.00",₹446.00,21,2
B0CVDWCTFG,B0CVDWCTFG,TREE MAISON CORONATING HOMES Brass Natraj Statue | Lord Shiva Dancing Natraj Idol | Traditional Sculpture for Home Decor | Vastu & Feng Shui | Nataraj Murti Showpiece | 21cm Approx,BRASS-NATRAL-JI-STATUE,769,18,0.94%,0.56%,"1,227",26,1.03%,0.54%,100.00%,100.00%,21,3,2.73%,16.67%,"₹39,879.00","₹5,697.00",21,3
B09DPPD44R,B09DPPD44R,TREEMAISON Vastu Yellow Color Tape | Size - 4 Inch | Length- 20 Meter (Approx) | Vastu Remedy for Toilet | Main Door Entrance | Tape Remedy | Pack of 1,BIG-TAPE-YELLOW,102,2,0.13%,0.06%,145,2,0.12%,0.04%,100.00%,100.00%,22,0,21.57%,0.00%,"₹6,050.00",₹0.00,20,0
B0BG1V5ZB9,B0BG1V5ZB9,"TREE MAISON CORONATING HOMES Metal Vastu Lead 3 Layer Pyramid | Lead Vastu Remedy | 3-Inch | Pyramid for Positive Energy, Health & Wealth | Vastu Dosh Remedies for Home & Office | Pack of 1",3-LAYER-PYRMD-LEAD,173,8,0.21%,0.25%,251,12,0.21%,0.25%,100.00%,100.00%,41,4,23.70%,50.00%,"₹33,400.00","₹3,340.00",20,2
B0F946HHPW,B0F946HHPW,BRONGS Copper Dowsing L Rods Pair | Diameter-8 MM | Aura Energy Checker | Finding Underground Water & Geopathic Stress | Reiki | Divining Rods (Pendulum Assorted),8MM-COPPER-DOWSING-HANDLE-ROD,610,25,0.75%,0.77%,907,41,0.76%,0.85%,100.00%,100.00%,20,0,3.28%,0.00%,"₹37,780.00",₹0.00,20,0
B0FPCFNQRG,B0FPCFNQRG,BRONGS Vastu Dowsing Dark Brown Board |Size-9 Inch Approx |7 Chakra Pendulum| Divination Metaphysical Message Board | Dowsing Board with Seven Chakra Crystal Pendulum |Vastu Remedy,BG-D.BROWN-BOARD+CRYS-PEND-9IN,91,1,0.11%,0.03%,172,1,0.14%,0.02%,98.62%,100.00%,20,0,21.98%,0.00%,"₹10,367.00",₹0.00,20,0
B09814QWSQ,B09814QWSQ,"Treemaison Paper Village Scene - Vastu Remedy, Painting Village Scene Without Frame, 17 Inch",VASTU-VILLAGE-PAINTING-WITHOUT-FRAME,555,24,0.68%,0.74%,785,29,0.66%,0.60%,97.35%,100.00%,20,2,3.60%,8.33%,"₹5,300.00",₹530.00,19,2
B09LV79FZT,B09LV79FZT,TREEMAISON Vastu Zinc Helix for Vastu Remedy | Vastu Remedies for Toilet - Door | Zone Correction | Vastu Dosh Nivaran Remedies | Size- 4 Inch Approx | Pack of 3,3-INCH-ZINC-HELIX-ST3,352,16,0.43%,0.49%,558,22,0.47%,0.46%,98.95%,100.00%,22,3,6.25%,18.75%,"₹21,974.00","₹2,993.00",19,3
B0CDHCBFLX,B0CDHCBFLX,TREE MAISON CORONATING HOMES Vastu White Tape | Size - 3 Inch (72 mm) Approx | Length- 20 Meter (Approx) | Vastu Tape Remedy for Toilet | Vastu Tape for Main Door | Tape Remedy | Pack of 1,3-INCH-TAPE-WHITE-ST-1,72,4,0.09%,0.12%,92,4,0.08%,0.08%,98.75%,100.00%,20,1,27.78%,25.00%,"₹5,300.00",₹265.00,19,1
B0DK3DGYBV,B0DK3DGYBV,TREE MAISON CORONATING HOMES Ramal Passa Pair | Brass Ramal Pase | Divination Tool | Ramal Dice | Ramal Shastra Astrology Dice | Predictions & Positive Energy,RAMAL-PASE-PAIR,474,11,0.58%,0.34%,724,12,0.61%,0.25%,100.00%,100.00%,20,1,4.22%,9.09%,"₹17,728.00",₹897.00,19,1
B0B4DG2BGF,B0B4DG2BGF,"TREE MAISON CORONATING HOMES Vastu Acrylic Shakti Chakra | Size- 6 Inch | Featuring 45 Devtas, 16 Attributes | with Color | Health Chart | Rajas, Sattav, Tamas for vaastu Shashtra Remedy",6-INCH-SHAKTI-CHAKRA,360,15,0.44%,0.46%,538,21,0.45%,0.44%,99.29%,100.00%,18,2,5.00%,13.33%,"₹4,556.00",₹536.00,18,2
B0BG1VXN9F,B0BG1VXN9F,"TREE MAISON CORONATING HOMES Vastu Brass 3 Layer Pyramid | Pure Brass Vastu Remedy | 3-Inch | Pyramid for Positive Energy, Health & Wealth | Vastu Dosh Remedies for Home & Office | Pack of 1",3-LAYER-PYRMD-BRASS,351,21,0.43%,0.65%,461,32,0.39%,0.66%,99.76%,100.00%,37,4,10.54%,19.05%,"₹53,135.00","₹5,842.00",18,4
B0CDHBQ8L6,B0CDHBQ8L6,TREE MAISON CORONATING HOMES Vastu Blue Tape | Size - 3 Inch (72 mm) Approx | Length- 20 Meter (Approx) | Tape for Vastu Correction | Tape for Toilet Correction | Pack of 1,3-INCH-TAPE-BLUE-ST-1,107,5,0.13%,0.15%,136,6,0.11%,0.12%,99.18%,100.00%,19,2,17.76%,40.00%,"₹5,035.00",₹530.00,18,2
B09TXTB7BW,B09TXTB7BW,TREE MAISON CORONATING HOMES Brass Buddha Statue | Peaceful Meditating Buddha Idol | Home & Office Decor | Vastu & Feng Shui Positive Energy | Buddha Idols for Home Decor | 7x2x4 Inch,VASTU-BUDDHA,744,18,0.91%,0.56%,"1,145",26,0.96%,0.54%,100.00%,100.00%,18,1,2.42%,5.56%,"₹33,152.00","₹1,804.00",17,1
B0CR638NMS,B0CR638NMS,TREE MAISON CORONATING HOMES Vastu Brass Strip | Width- 1 Inch | Thickness - 0.2mm | Length- 25 Feet Approx | Strip for Zone Balancing & Toilet Correction | Brass Strip for Vastu | Pack of 1,25FEET-1INCH-STRIP-BRASS-SET-1,75,7,0.09%,0.22%,110,17,0.09%,0.35%,100.00%,100.00%,23,5,30.67%,71.43%,"₹20,529.00","₹4,585.00",17,2
B0CR63WCS9,B0CR63WCS9,TREE MAISON CORONATING HOMES Vastu Copper Strip | Width- 1 Inch | Thickness - 0.2mm | Length- 25 Feet Approx | Vastu Copper Strip for Toilet Correction | Copper Strip for Vastu | Pack of 1,25FEET-1INCH-STRIP-COPPER-SET-1,255,22,0.31%,0.68%,359,29,0.30%,0.60%,99.06%,100.00%,20,2,7.84%,9.09%,"₹28,404.00","₹2,874.00",17,1
B0DH28SK17,B0DH28SK17,"TREE MAISON CORONATING HOMES Vastu Brass 3 Layer Pyramid | Pure Brass Vastu Remedy | 2-Inch | Pyramid for Positive Energy, Health & Wealth | Vastu Dosh Remedies for Home & Office | Pack of 1",2IN-3-LAYER-BRASS-PYRAMID,187,10,0.23%,0.31%,258,12,0.22%,0.25%,100.00%,100.00%,21,4,11.23%,40.00%,"₹15,721.00","₹2,988.00",17,3
B0CJMGZD1F,B0CJMGZD1F,TREE MAISON CORONATING HOMES Vastu Brown Dowsing Board | Size- 6 Inch | Metaphysical Message Board for Witchcraft with Brass Pendulum (Pendulum Assorted) Acrylic Divination Board,BROWN-BOARD-PENDULUM-02,179,2,0.22%,0.06%,239,2,0.20%,0.04%,100.00%,100.00%,16,0,8.94%,0.00%,"₹4,784.00",₹0.00,16,0
B09PBX6T91,B09PBX6T91,"TREE MAISON CORONATING HOMES Vastu Red Horses Statue | Two Running Horses for Victory, Business Growth & Positive Energy | Feng Shui and Vastu Decor | Good Luck Sculpture for Home & Office",RED-HORSE,114,10,0.14%,0.31%,181,11,0.15%,0.23%,95.21%,100.00%,15,3,13.16%,30.00%,"₹10,807.00","₹2,227.00",15,3
B09KXW9PQK,B09KXW9PQK,TREEMAISON Vastu Green Tape | Size - 2 Inch (48 mm) Approx | Length- 20 Meter (Approx) | Vastu Tape Remedy for Toilet | Vastu Tape for Main Door Entrance | Tape Remedy | Pack of 1,GREEN-2-INCH-TAPE-ST1,43,2,0.05%,0.06%,59,3,0.05%,0.06%,96.00%,100.00%,14,0,32.56%,0.00%,"₹3,178.00",₹0.00,14,0
B0CR62XYWT,B0CR62XYWT,TREE MAISON CORONATING HOMES Vastu Copper Strip | Width- 1 Inch | Thickness - 0.2mm | Length- 12 Feet Approx | Strip for Zone Balancing & Toilet Correction | Copper Strip for Vastu | Pack of 1,12FEET-1INCH-STRIP-COPPER-SET-1,51,4,0.06%,0.12%,75,5,0.06%,0.10%,100.00%,100.00%,15,0,29.41%,0.00%,"₹8,965.00",₹0.00,13,0
B0CZHR6GCQ,B0CZHR6GCQ,TREE MAISON CORONATING HOMES Natural Turquoise Bracelet | Certified 8mm Faceted Beads | Healing Crystal Bracelet for Positive Energy| Stretchable Gemstone Bracelet for Men & Women,TURQUOISE-BRACELET,173,2,0.21%,0.06%,239,4,0.20%,0.08%,100.00%,100.00%,13,0,7.51%,0.00%,"₹3,692.00",₹0.00,13,0
B0G5X681XM,B0G5X681XM,BRONGS Copper 9 Pyramid Strip |Size- 7Inch | Vastu Remedy Tool |Strip with Pyramid Design for Correcting Corner | Home & Spritual Decor | Pack of 1,BG-9-PYR-STRIP-COPPER-7IN-ST-1,148,1,0.18%,0.03%,207,1,0.17%,0.02%,100.00%,100.00%,19,0,12.84%,0.00%,"₹9,006.00",₹0.00,13,0
B09G393ZCR,B09G393ZCR,TREEMAISON Vastu Copper Strip | Width- 0.5 Inch | Thickness - 0.3mm | Length- 8 Feet Approx | Zone Balancing | Vastu Copper Strip for Toilet Correction | Copper Strip for Vastu | Pack of 1,8FT-0.5''-COPPER-0.3MM-SET-1,"2,867",147,3.52%,4.55%,"4,268",250,3.57%,5.19%,99.51%,100.00%,15,0,0.52%,0.00%,"₹3,725.50",₹0.00,12,0
B09NPXZY88,B09NPXZY88,BRONGS Vastu Brass Strip | Width- 0.5 Inch | Thickness - 0.3mm | Length- 8 Feet Approx | Zone Balancing |Toilet Correction | Main Entrance | Brass Strip for Vastu | Pack of 1,BRASS-STRIP-0.5 INCH-ST1,166,13,0.20%,0.40%,231,19,0.19%,0.39%,99.02%,100.00%,24,1,14.46%,7.69%,"₹7,176.00",₹299.00,12,1
B0BCGSZ8W3,B0BCGSZ8W3,TREE MAISON CORONATING HOMES Vastu 3 Layer Pyramid | Plastic Pyramid Remedy for Home & Office | Color - White,3LAYER-PLASTIC-PYRAMID-WHITE,131,6,0.16%,0.19%,178,6,0.15%,0.12%,98.78%,100.00%,18,2,13.74%,33.33%,"₹4,770.00",₹530.00,12,2
B0CGNQXBRM,B0CGNQXBRM,TREE MAISON CORONATING HOMES Copper Dowsing L- Rods Pair |Diameter-5 MM | Set of Board & Brass Pendulum| Aura Energy Checker | Finding Underground Water & Geopathic Stress | Dowser | Pendulum Assorted,5mm-copper-rod-with-handle,122,1,0.15%,0.03%,183,1,0.15%,0.02%,100.00%,100.00%,12,0,9.84%,0.00%,"₹11,988.00",₹0.00,12,0
B0FHH2XDKP,B0FHH2XDKP,"TREE MAISON CORONATING HOMES Selenite Charging Plate – 3 Inch with 10–20 Gram Raw Pyrite Stone | Selenite Plate for Crystal Charging, Energy Healing & Spiritual Decor",SHREEYANTRA-ROUND-PLT-10GM-PYRIT,96,3,0.12%,0.09%,131,5,0.11%,0.10%,99.13%,100.00%,12,0,12.50%,0.00%,"₹4,320.00",₹0.00,12,0
