(Parent) ASIN,(Child) ASIN,Title,SKU,Sessions - Total,Sessions - Total - B2B,Session Percentage - Total,Session Percentage - Total - B2B,Page Views - Total,Page Views - Total - B2B,Page Views Percentage - Total,Page Views Percentage - Total - B2B,Featured Offer Percentage,Featured Offer Percentage - B2B,Units Ordered,Units Ordered - B2B,Unit Session Percentage,Unit Session Percentage - B2B,Ordered Product Sales,Ordered Product Sales - B2B,Total Order Items,Total Order Items - B2B
B09YNJN5SP,B09YNJN5SP,TREE MAISON CORONATING HOMES Vastu Helix Copper (Plain) | Helix Fire (South-East) | Main Door Entrance & Toilet Dosh Correction | Vastu Dosh Nivaran Remedies (6-inch) | Pack of 3,6-INCH-PLAIN-COPPER-HELIX-ST3,9,0,0.01%,0.00%,12,0,0.01%,0.00%,100.00%,0.00%,2,0,22.22%,0.00%,"₹4,986.00",₹0.00,2,0
B09YNJW4R9,B09YNJW4R9,TREE MAISON CORONATING HOMES Vastu Helix Copper (Plain) | Helix Fire (South-East) | Main Door Entrance & Toilet Dosh Correction | Vastu Dosh Nivaran Remedies (4-inch) | Pack of 1,4-INCH-PLAIN-COPPER-HELIX-ST1,7,0,0.01%,0.00%,9,0,0.01%,0.00%,100.00%,0.00%,2,1,28.57%,0.00%,"₹1,138.00",₹569.00,2,1
B09YNLHF4X,B09YNLHF4X,TREE MAISON CORONATING HOMES Vastu Helix Brass (Hii) | Helix Earth (North-West) | Main Door Entrance & Toilet Dosh Correction | Vastu Dosh Nivaran Remedies (4-inch) | Pack of 3,4-INCH-HII-BRASS-HELIX-ST3,17,0,0.02%,0.00%,35,0,0.03%,0.00%,100.00%,0.00%,4,0,23.53%,0.00%,"₹6,380.00",₹0.00,2,0
B0B4639MCD,B0B4639MCD,TREE MAISON CORONATING HOMES Vastu White Color Tape |Size - 4 Inch| Length- 8 Feet (Approx) |Vastu Remedy for Toilet | Main Door Entrance | Tape Remedy | Pack of 1,VNL-SML-WHITE-PCK1,13,0,0.02%,0.00%,14,0,0.01%,0.00%,100.00%,0.00%,2,0,15.38%,0.00%,₹400.00,₹0.00,2,0
B0B4G7ZVDZ,B0B4G7ZVDZ,TREE MAISON CORONATING HOMES Vastu Red Color Tape |Size - 3 Inch| Length- 8 Feet (Approx) |Vastu Remedy for Toilet | Main Door Entrance | | Tape Remedy | (Pack of 1),3-INCH-VINYL-TAPE-RED,23,1,0.03%,0.03%,25,1,0.02%,0.02%,100.00%,100.00%,2,0,8.70%,0.00%,₹378.00,₹0.00,2,0
B0B6C652LJ,B0B6C652LJ,TREE MAISON CORONATING HOMES Vastu Blue - White Tape | Size - 3 Inch (72 mm) Approx | Length- 20 Meter (Approx) | Vastu Tape Remedy for Toilet | Vastu Tape for Main Door | Tape Remedy | Pack of 2,BLUE-WHITE-3INCH-TAPE-ST02-merchant,17,0,0.02%,0.00%,23,0,0.02%,0.00%,100.00%,0.00%,2,0,11.76%,0.00%,₹872.00,₹0.00,2,0
B0B71KX5FG,B0B71KX5FG,TREE MAISON CORONATING HOMES Vastu Red Color Tape | Size - 3 Inch | Length- 10 Feet (Approx) | Vastu Remedy for Toilet | Main Door Entrance | Tape Remedy | Pack of 1,VNYL-TAPE-3INCH-RED,13,0,0.02%,0.00%,18,0,0.02%,0.00%,100.00%,0.00%,2,0,15.38%,0.00%,₹378.00,₹0.00,2,0
B0BCGSMYY7,B0BCGSMYY7,TREE MAISON CORONATING HOMES Vastu 3 Layer Blue Pyramid | Plastic Moulded Multi-Layer Plastic Pyramid | Vastu Remedy for Home & Office | Pack of 1,3LAYER-PLASTIC-PYRAMID-BLUE,17,1,0.02%,0.03%,22,1,0.02%,0.02%,100.00%,0.00%,2,0,11.76%,0.00%,₹568.00,₹0.00,2,0
B0BG1PVRT8,B0BG1PVRT8,"TREE MAISON CORONATING HOMES Metal Vastu Aluminium 3 Layer Pyramid | Aluminium Vastu Remedy | 3-Inch | Pyramid for Positive Energy, Health & Wealth | Vastu Dosh Remedies for Home & Office | Pack of 1",3-LAYER-PYRMD-ALUMINIUM,26,3,0.03%,0.09%,35,6,0.03%,0.12%,100.00%,100.00%,6,3,23.08%,100.00%,"₹4,956.00","₹2,478.00",2,1
B0BGRKG7JD,B0BGRKG7JD,TREE MAISON CORONATING HOMES Vastu Combo of 5 Color Tape | Size - 1 Inch (24 mm) Approx | Length- 20 Meter (Approx) | Vastu Tape Remedy for Toilet | Vastu Tape for Main Door Entrance | Pack of 5,1-INCH-TAPE-SET-5,79,4,0.10%,0.12%,100,4,0.08%,0.08%,100.00%,100.00%,2,0,2.53%,0.00%,₹968.00,₹0.00,2,0
B0BJZX8184,B0BJZX8184,TREE MAISON CORONATING HOMES Vastu Brass Strip | Width-1 Inch | Thickness -1mm | Length- 8 Feet Approx | Zone Balancing |Toilet Correction | Main Entrance | Brass Strip for Vastu | Pack of 1,BIG-18MM-STRIP-BRASS,20,2,0.02%,0.06%,33,4,0.03%,0.08%,100.00%,100.00%,2,1,10.00%,50.00%,"₹3,038.00","₹1,519.00",2,1
B0BSLB9P9Q,B0BSLB9P9Q,TREE MAISON CORONATING HOMES Vastu Stainless Steel Strip | Width- 1 Inch | Thickness - 0.3mm | Length- 8 Feet Approx | Zone Balancing | Toilet Correction | Stainless Steel Strip for Vastu | Pack of 2,1IN-S.STEEL-STRIP-ST-2,4,0,0.00%,0.00%,9,0,0.01%,0.00%,100.00%,0.00%,2,0,50.00%,0.00%,₹920.00,₹0.00,2,0
B0CDH7HYGR,B0CDH7HYGR,TREE MAISON CORONATING HOMES Vastu Red Tape | Size - 3 Inch (72 mm) Approx | Length- 20 Meter (Approx) | Vastu Tape for Toilet Correction | Vastu Tape for Main Door | Tape Remedy | Pack of 1,3IN-TAPE-RED-ST-1,717,35,0.88%,1.08%,"1,012",46,0.85%,0.96%,99.78%,100.00%,2,0,0.28%,0.00%,₹518.00,₹0.00,2,0
B0CDM33S93,B0CDM33S93,"TREE MAISON CORONATING HOMES Vastu Stainless Steel Strip | 0.5 INCH | Pack of 1 | Vastu Steel Strip for Toilet | Vastu Strip Remedy | Width-12mm, Thickness-0.2mm, Length-8 Feet Approx",LW-0.5INCH-S.STEEL-ST1,27,3,0.03%,0.09%,40,3,0.03%,0.06%,100.00%,100.00%,11,0,40.74%,0.00%,"₹2,497.00",₹0.00,2,0
B0CJMGZD1F,B0CJMGZD1F,TREE MAISON CORONATING HOMES Vastu Brown Dowsing Board | Size- 6 Inch | Metaphysical Message Board for Witchcraft with Brass Pendulum (Pendulum Assorted) Acrylic Divination Board,DARKBROWN-BOARD-PENDULUM,179,2,0.22%,0.06%,239,2,0.20%,0.04%,100.00%,100.00%,2,0,1.12%,0.00%,₹515.22,₹0.00,2,0
B0CLVJZDFB,B0CLVJZDFB,TREE MAISON CORONATING HOMES Brass Swastik (卐) Sathiya Wall Hanging Yantra | 6 Inches | Vastu Door Hanging for Good Luck & Auspicious Energy | Decorative Home Decor Symbol for Positive Vibes,6-INCH-STAR-BRASS-SWASTIK-HELIX-ST1,26,0,0.03%,0.00%,42,0,0.04%,0.00%,100.00%,0.00%,2,0,7.69%,0.00%,"₹1,398.00",₹0.00,2,0
B0CLVN37GN,B0CLVN37GN,TREE MAISON CORONATING HOMES Vastu Zinc Chand Helix for Vastu Remedy | Zone Correction | Vastu Dosh Nivaran Remedies | Size- 4 Inch Approx | Pack of 1,ZINC-CHAND-HELIX-4INCH-ST1,28,1,0.03%,0.03%,36,1,0.03%,0.02%,100.00%,100.00%,2,0,7.14%,0.00%,₹920.00,₹0.00,2,0
B0CPVM67K3,B0CPVM67K3,TREE MAISON CORONATING HOMES Vastu Brass Strip | Width- 0.5 Inch | Thickness - 0.2mm | Length- 8 Feet Approx | Zone Balancing |Toilet Correction | Brass Strip for Vastu | Pack of 1,LW-BRASS-0.5INCH-STRIP-SET-1,16,0,0.02%,0.00%,17,0,0.01%,0.00%,100.00%,0.00%,2,0,12.50%,0.00%,₹568.00,₹0.00,2,0
B0CPVMRW61,B0CPVMRW61,TREE MAISON CORONATING HOMES Vastu Iron Strip | Width- 0.5 Inch | Thickness - 0.2mm | Length- 8 Feet Approx | Zone Balancing |Toilet Correction | Iron Strip for Vastu | Pack of 1,LW-IRON-0.5INCH-STRIP-SET-1,19,1,0.02%,0.03%,23,1,0.02%,0.02%,100.00%,100.00%,2,0,10.53%,0.00%,₹454.00,₹0.00,2,0
B0CQ8RPKBZ,B0CQ8RPKBZ,"TREE MAISON CORONATING HOMES Brass Design Camel Statue | Weight - 780 G Approx | 7 Inch Approx | Vastu Brass Camel | Camel Statue for Vastu | Showpeice for Home & Office | Zonal Placement-W,WNW",BRASS-CAMEL,11,5,0.01%,0.15%,20,8,0.02%,0.17%,100.00%,100.00%,2,0,18.18%,0.00%,"₹2,848.00",₹0.00,2,0
B0CQV82D4Y,B0CQV82D4Y,TREE MAISON CORONATING HOMES Copper Dowsing Rods Pair | Diameter-8 MM | Energy Balancing | Aura Energy Checker | Feng Shui | Reiki | Dowser | Divining Rod | L-Rod | Only 2 Rods,8MM-COPPER-WITHOUT-HANDLE-ONLY,35,1,0.04%,0.03%,59,1,0.05%,0.02%,100.00%,100.00%,2,0,5.71%,0.00%,"₹2,658.00",₹0.00,2,0
B0CQVBX73X,B0CQVBX73X,TREE MAISON CORONATING HOMES Vastu Copper Dowsing L-Rod | 5 MM DIAMETER | Vastu Energy Correction Tool for Home & Office | Copper L Shaped Dowsing Rod for Positive Energy | Only 2 Rods,5MM-ONLY-COPPER-WITHOUT-HANDLE,96,3,0.12%,0.09%,132,3,0.11%,0.06%,100.00%,100.00%,2,0,2.08%,0.00%,"₹1,598.00",₹0.00,2,0
B0CQYTZ9GP,B0CQYTZ9GP,TREE MAISON CORONATING HOMES Zinc Swastik (卐) Sathiya Wall Hanging Yantra | 5 Inches | Vastu Door Hanging for Good Luck & Auspicious Energy | Decorative Home Decor Symbol for Positive Vibes,ZINC-SATIYA-5INCH,36,1,0.04%,0.03%,44,1,0.04%,0.02%,100.00%,100.00%,3,0,8.33%,0.00%,"₹1,992.00",₹0.00,2,0
B0CR478K12,B0CR478K12,TREE MAISON CORONATING HOMES Copper Strip | Width-0.5 Inch | Thickness -0.2mm | Length-12 Feet Approx | Zone Balancing |Toilet Correction | Main Entrance | Copper Strip for Vastu | Pack of 1,12FEET-0.5INCH-STRIP-COPPER-SET-1,29,2,0.04%,0.06%,39,2,0.03%,0.04%,100.00%,100.00%,2,0,6.90%,0.00%,₹854.00,₹0.00,2,0
B0CR63WCS9,B0CR63WCS9,TREE MAISON CORONATING HOMES Vastu Copper Strip | Width- 1 Inch | Thickness - 0.2mm | Length- 25 Feet Approx | Vastu Copper Strip for Toilet Correction | Copper Strip for Vastu | Pack of 1,25FEET-1INCH-STRIP-COPPER-ST-1,255,22,0.31%,0.68%,359,29,0.30%,0.60%,99.06%,100.00%,2,0,0.78%,0.00%,"₹2,855.00",₹0.00,2,0
B0CTFHV85G,B0CTFHV85G,"TREE MAISON CORONATING HOMES Vastu Acrylic Shakti Chakra with Color | Size- 6 Inch | Featuring 45 Devtas, 16 Attributes, Health Chart, Rajas, Sattav, Tamas for Vaastu Shashtra Remedy",VASTU-6INCH-SHAKTI-CHAKRA-01,14,1,0.02%,0.03%,20,1,0.02%,0.02%,100.00%,100.00%,2,0,14.29%,0.00%,₹536.00,₹0.00,2,0
B0CTFJ2M99,B0CTFJ2M99,"TREE MAISON CORONATING HOMES Vastu Acrylic Shakti Chakra with Color | Size- 9 Inch | Featuring 45 Devtas, 16 Attributes, Health Chart, Rajas, Sattav, Tamas for vaastu Shashtra Remedy",VASTU-9INCH-SHAKTI-CHAKRA-01,46,0,0.06%,0.00%,70,0,0.06%,0.00%,98.25%,0.00%,2,0,4.35%,0.00%,₹818.00,₹0.00,2,0
B0CTFJXMCS,B0CTFJXMCS,"TREE MAISON CORONATING HOMES Vastu Acrylic Shakti Chakra | 7 Inch | Featuring 45 Devtas, 16 Attributes, Health Chart, Rajas, Sattav, Tamas for vaastu Shashtra Remedy",VASTU-7INCH-RED-SHAKTI-CHAKRA,39,1,0.05%,0.03%,61,1,0.05%,0.02%,100.00%,100.00%,2,0,5.13%,0.00%,₹598.00,₹0.00,2,0
B0CVDP89HW,B0CVDP89HW,TREE MAISON CORONATING HOMES Vastu Brass Indradev Ji Statue | Weight - 1 KG Aprrox | Height - 15 Cm Approx | Vastu Remedy | Home & Office Decor | Indra Dev Idol for Vastu | Pack of 1,BRASS-INDERDEV-JI-STATUE,26,0,0.03%,0.00%,39,0,0.03%,0.00%,100.00%,0.00%,2,0,7.69%,0.00%,"₹3,798.00",₹0.00,2,0
B0CVDPGDVM,B0CVDPGDVM,"TREE MAISON CORONATING HOMES Brass Camel Plain Statue | Weight - 690 G Approx | 7 Inch Approx | Vastu Brass Showpiece for Home| Camel Statue for Vastu | (Zonal Placement-W,WNW)",PLAIN-CAMEL,92,3,0.11%,0.09%,126,6,0.11%,0.12%,99.06%,100.00%,2,1,2.17%,33.33%,"₹2,848.00","₹1,424.00",2,1
B0CVDRX554,B0CVDRX554,TREE MAISON CORONATING HOMES Brass Vaastu Tortoise | Weight - 590 Gram Approx | Turtle | Feng Shui | Vastu Shastra Remedies | Home Decor | Turtle for Good Luck | Pack of 1,SMALL-TURTLE,31,1,0.04%,0.03%,41,1,0.03%,0.02%,100.00%,100.00%,2,0,6.45%,0.00%,"₹1,898.00",₹0.00,2,0
B0CVDV9XRL,B0CVDV9XRL,TREE MAISON CORONATING HOMES Brass Kuber Ji Statue | Size- 12 CM Approx | Weight-590 G Approx | Vastu Brass Kuber Ji | Vastu Idol for Home and Office | Kubera Idol | Zonal Placement - North,BRASS-KUBER-STATUE,90,2,0.11%,0.06%,140,5,0.12%,0.10%,100.00%,100.00%,2,0,2.22%,0.00%,"₹2,278.00",₹0.00,2,0
B0CZ4B73D5,B0CZ4B73D5,"TREE MAISON CORONATING HOMES Turquoise Crystal Pyramid (2 Inch) | Feng Shui & Vastu Correction | Crystal Pyramid for Positive Energy, Health, Good Luck | | Home & Office Decor | Gift |",TURQUOISE-PYRAMID-2INCH,16,0,0.02%,0.00%,21,0,0.02%,0.00%,100.00%,0.00%,2,0,12.50%,0.00%,₹598.00,₹0.00,2,0
B0D9LZCJGP,B0D9LZCJGP,TREEMAISON Vastu Combo of White-Green Color Tape |Size - 4 Inch| Length- 8 Feet (Approx) |Vastu Remedy for Toilet | Main Door Entrance | | Tape Remedy | Pack of 2,VINYL-TAPE-GREEN-WHITE-4-INCH,11,2,0.01%,0.06%,11,2,0.01%,0.04%,100.00%,100.00%,2,1,18.18%,50.00%,₹512.00,₹256.00,2,1
B0DB2DZ57L,B0DB2DZ57L,TREE MAISON CORONATING HOMES Vastu Blue Color Tape | Size - 3 Inch | Length- 10 Feet (Approx) | Vastu Remedy for Toilet | Main Door Entrance | Tape Remedy | Pack of 1,3INCH-BLUE-VNYL-TAPE,17,0,0.02%,0.00%,24,0,0.02%,0.00%,100.00%,0.00%,3,0,17.65%,0.00%,₹564.12,₹0.00,2,0
B0DDQ5B4JV,B0DDQ5B4JV,TREE MAISON CORONATING HOMES Vastu Bhallat Devta Divs (Set-3) - Vastu Remedy to Awaken Devta Fields |Weight- 50gm Approx |Pack of 1,BHALLAT-DIVS-NO.-41,19,0,0.02%,0.00%,19,0,0.02%,0.00%,100.00%,0.00%,3,0,15.79%,0.00%,₹852.00,₹0.00,2,0
B0DDTH8L8D,B0DDTH8L8D,"TREE MAISON CORONATING HOMES Pure Copper Hollow Pyramid | 4 inch | Positive Vastu Energy for Vibrations at Home, Office Positive Energy Remedies Health and Wealth Benefits Boost Positive Energy",4IN-COPPER-PLN-HLW-PYRAMID-W/O-PLATE,26,0,0.03%,0.00%,38,0,0.03%,0.00%,100.00%,0.00%,2,0,7.69%,0.00%,"₹1,293.00",₹0.00,2,0
B0DF2YLKWZ,B0DF2YLKWZ,"TREEMAISON Acrylic Vastu Shakti Chakra | Size- 6 Inch | Featuring 45 Devtas, 16 Attributes | Health Chart | Rajas, Sattav, Tamas for vaastu Shashtra Remedy (Without Color)",SHAKTI-CHAKRA-02-AB,75,1,0.09%,0.03%,111,1,0.09%,0.02%,98.96%,100.00%,2,0,2.67%,0.00%,₹536.00,₹0.00,2,0
B0DG92RW89,B0DG92RW89,TREE MAISON CORONATING HOMES Vastu Brass Strip | Width- 0.5 Inch | Thickness - 0.2mm | Length- 50 Feet Approx | Strip for Entrance & Toilet Correction | Brass Strip for Vastu | Pack of 1,50FEET-0.5INCH-STRIP-BRASS-SET-1,12,0,0.01%,0.00%,24,0,0.02%,0.00%,100.00%,0.00%,4,0,33.33%,0.00%,"₹4,196.00",₹0.00,2,0
B0DG946N6L,B0DG946N6L,TREE MAISON CORONATING HOMES Vastu Brass Strip | Width- 1 Inch | Thickness - 0.2mm | Length- 50 Feet Approx | Strip for Entrance & Toilet Correction | Brass Strip for Vastu | Pack of 1,50FEET-1INCH-STRIP-BRASS-SET-1,26,1,0.03%,0.03%,32,2,0.03%,0.04%,100.00%,0.00%,3,0,11.54%,0.00%,"₹5,697.00",₹0.00,2,0
B0DGGSB3D9,B0DGGSB3D9,TREE MAISON CORONATING HOMES Vastu Acrylic Vedic Shakti Chakra with Brass Pendulum | 6 Inch | Health Chart | Vastu Shakti Chakra | vastu Grid Map | Vastu Chakra | Vastu Shakti Chakra Remedy,VEDIC-S.C-6IN-BRASS-PENDULUM,49,1,0.06%,0.03%,63,1,0.05%,0.02%,95.00%,100.00%,2,0,4.08%,0.00%,₹661.47,₹0.00,2,0
B0DHVQD2KL,B0DHVQD2KL,TREE MAISON CORONATING HOMES Vastu Toilet Blocker | Toilet Negative Energy Blocker | Vastu Entrance Blocker | Size- 4 Inches Approx | Vastu Entry Blocker for All Direction Entrance Remedy | Pack of 2,TOILET-BLOCKER-ST2,10,0,0.01%,0.00%,15,0,0.01%,0.00%,100.00%,0.00%,2,0,20.00%,0.00%,"₹2,754.00",₹0.00,2,0
B0DHZ91YVY,B0DHZ91YVY,"TREE MAISON CORONATING HOMES Crystal Maha Laxmi Pyramid (2.7 inch) | Crystal Pyramid for Positive Energy, Wealth, Meditation, Money, Health, Good Luck | Office, Home Décor, Gift",2IN-LAXMI-PYRAMID,33,0,0.04%,0.00%,42,0,0.04%,0.00%,100.00%,0.00%,4,0,12.12%,0.00%,"₹1,196.00",₹0.00,2,0
B0DHZCCXN9,B0DHZCCXN9,TREE MAISON CORONATING HOMES 7 Chakra Orgone Pyramid | 2 Inch | Crystal Healing Energy Generator | Reiki Meditation Pyramid | Vastu & Feng Shui Pyramid | Decorative Home & Office Gift,2IN-SEVEN-CHAKRA-PYRAMID,58,2,0.07%,0.06%,77,2,0.06%,0.04%,98.57%,100.00%,2,0,3.45%,0.00%,₹598.00,₹0.00,2,0
B0DJGQGRF7,B0DJGQGRF7,"TREE MAISON CORONATING HOMES Kamdhenu Cow Statue | Vastu Idol for Home and Office | Vastu 3D Remedy | Zonal Placement -ESE | (Size-8 * 10.5 CM, WEIGHT-540 GRAM Approx)",BRASS-SMALL-KAMDHENU-COW,158,3,0.19%,0.09%,201,3,0.17%,0.06%,98.26%,100.00%,2,0,1.27%,0.00%,"₹2,468.00",₹0.00,2,0
B0DK8XPJD5,B0DK8XPJD5,TREE MAISON CORONATING HOMES Vastu Toilet Blocker | Toilet Negative Energy Blocker | Vastu Entrance Blocker | Size- 4 Inches Approx | Vastu Entry Blocker for All Direction Entrance Remedy (Pack of 1),TOILET-BLOCKER-PC-1,19,2,0.02%,0.06%,26,3,0.02%,0.06%,100.00%,100.00%,2,0,10.53%,0.00%,"₹1,424.00",₹0.00,2,0
B0DNWH6PQJ,B0DNWH6PQJ,TREE MAISON CORONATING HOMES Brass Sun Statue | Brass Sun for Vastu | Weight - 832 G Approx | Size-15 * 15 * 2 CM | Vastu Idol for Home and Office | Zonal Placement-East,NEW-SUN-FACE-BRASS-STATUE,59,1,0.07%,0.03%,76,1,0.06%,0.02%,100.00%,100.00%,3,0,5.08%,0.00%,"₹4,557.00",₹0.00,2,0
B0DP6HG1F2,B0DP6HG1F2,"TREE MAISON CORONATING HOMES Pure Copper Plain Hollow Pyramid | 2 inch |Weight- 10gm Approx |Pack of 1 | Boost Positive Energy| Energy for Vibrations at Home, Office | Powerful Positive Energy",2IN- COPPER- HLW-PLN-PYRAMID-ST-1,24,2,0.03%,0.06%,27,2,0.02%,0.04%,100.00%,100.00%,2,0,8.33%,0.00%,₹474.00,₹0.00,2,0
B0DP6JGNQB,B0DP6JGNQB,"TREE MAISON CORONATING HOMES Pure Copper Plain Hollow Pyramid | 2 inch |Weight of 1 Pyramid- 10gm Approx |Pack of 4 | Boost Positive Energy for Vastu | Energy for Vibrations at Home, Office",2IN- COPPER- HLW-PLN-PYRAMID-ST-4,15,1,0.02%,0.03%,20,1,0.02%,0.02%,100.00%,100.00%,2,0,13.33%,0.00%,₹828.00,₹0.00,2,0
B0DSJDWW5P,B0DSJDWW5P,"TREE MAISON CORONATING HOMES Vastu Copper Virtual Rod | 12-Inch |Weight- 1040gm Approx Virtual Entry Rod for Wealth, Prosperity & Success | Size: 12 Inch x 2.2cm Approx |Pack of 1",12IN-COPPER-VIRTUAL-ROD-ST1,38,2,0.05%,0.06%,46,2,0.04%,0.04%,100.00%,100.00%,2,1,5.26%,50.00%,"₹4,844.00","₹2,422.00",2,1
B0DTK85D1M,B0DTK85D1M,"TREE MAISON CORONATING HOMES Vastu Aluminium Spring (Set-9) | Vastu Anti Clock Wise Spring | Vastu Spring Remedy | Vastu Remedy | Direction-NNW, N, NNE, NE |",ALUMINIUM-ACW-SPRING-ST-9,9,1,0.01%,0.03%,17,1,0.01%,0.02%,100.00%,0.00%,3,0,33.33%,0.00%,"₹1,347.00",₹0.00,2,0
B0DTK85FRG,B0DTK85FRG,"TREEMAISON Aluminium Spring (Set-3) | Clock Wise Spring | Vastu Spring Remedy | Vastu Remedy | Direction-NNW, N, NNE, NE |",ALUMINIUM-CW-SPRING-ST-3,25,4,0.03%,0.12%,33,7,0.03%,0.15%,100.00%,100.00%,9,8,36.00%,200.00%,"₹2,556.00","₹2,272.00",2,1
B0DTK8L99F,B0DTK8L99F,"TREE MAISON CORONATING HOMES TREEMAISON Stainless Steel Spring (Set-3) | Anti Clock Wise Spring | Vastu Spring Remedy | Vastu Remedy | Direction-ENE, E, EWE |",STAINLESS STEEL-ACW-SPRING-ST-3,9,0,0.01%,0.00%,9,0,0.01%,0.00%,100.00%,0.00%,2,0,22.22%,0.00%,₹568.00,₹0.00,2,0
B0DYJSYTPX,B0DYJSYTPX,TREE MAISON CORONATING HOMES Copper Kilak (4 Inch Approx) Weight of 1 kilak- 146gm Approx| Conical Rod | Vastu Nail for Vastu Dosh Correction | Vastu Remedy | Vastu Kilak Remedy | (Set of 2),COPPER-KILAK-4INCH-SET-2,7,0,0.01%,0.00%,14,0,0.01%,0.00%,100.00%,0.00%,2,0,28.57%,0.00%,"₹1,798.00",₹0.00,2,0
B0DZXM3ZYL,B0DZXM3ZYL,TREE MAISON CORONATING HOMES Zinc Helix | 6 Inch | Energy Booster Vastu Remedy | Vastu Helix Remedy for Zone Correction | Zonal Placement - NE | Pack of 3,6IN-ZINC-HELIX-SET-3,15,0,0.02%,0.00%,27,0,0.02%,0.00%,100.00%,0.00%,2,0,13.33%,0.00%,"₹1,684.00",₹0.00,2,0
B0DZXPHJ54,B0DZXPHJ54,TREE MAISON CORONATING HOMES Lead Gaa Helix | 6 Inch | Energy Booster Vastu Remedy | Vastu Helix Remedy for Zone Correction | Zonal Placement - SW | Pack of 1,6IN-LEAD-GAA-HELIX-SET-1,19,1,0.02%,0.03%,21,1,0.02%,0.02%,100.00%,0.00%,7,0,36.84%,0.00%,"₹3,297.00",₹0.00,2,0
B0DZXR7233,B0DZXR7233,TREE MAISON CORONATING HOMES Lead Plain Helix | 6 Inch | Energy Booster Vastu Remedy | Vastu Helix Remedy for Zone Correction | Zonal Placement - SW | Pack of 3,6IN-LEAD-PLAIN-HELIX-SET-3,21,2,0.03%,0.06%,27,3,0.02%,0.06%,100.00%,100.00%,7,0,33.33%,0.00%,"₹9,968.00",₹0.00,2,0
B0F195KP57,B0F195KP57,TREE MAISON CORONATING HOMES Opalite Tumble Stone | 50 gm Tumbled Gemstones | Reiki Healing Stones | Home Decor Pebbles | Aquarium Gravel | Garden & Table Decor,OPALITE-TUMBLE-50-GRAM,46,2,0.06%,0.06%,58,2,0.05%,0.04%,100.00%,0.00%,2,0,4.35%,0.00%,₹568.00,₹0.00,2,0
B0F2SKBWDR,B0F2SKBWDR,"TREE MAISON CORONATING HOMES Vastu Copper Star Helix | Size- 6 Inch | for Main Entrance, Home-Kitchen & Bedroom Remedy for Vastu Dosh Vastu Shastra Remedies | South-East Direction | Pack of 1",6IN-STAR-COPPER-HELIX,6,1,0.01%,0.03%,9,1,0.01%,0.02%,100.00%,100.00%,8,7,133.33%,700.00%,"₹6,418.00","₹5,579.00",2,1
B0F2TFN5XR,B0F2TFN5XR,TREE MAISON CORONATING HOMES Zinc Helix | 4 Inch |Energy Booster Vastu Remedy| Vastu Helix Remedy for Zone Correction |Zonal Placement - NE | Pack of 3,4IN-ZINC-HELIX-SET-3,11,0,0.01%,0.00%,14,0,0.01%,0.00%,100.00%,0.00%,2,0,18.18%,0.00%,"₹1,704.00",₹0.00,2,0
B0F91PFV2H,B0F91PFV2H,TREE MAISON CORONATING HOMES Selenite Crystal Charging Plate | 3 Inch Approx |Selenite Plate to Charge Reiki Crystal |Selenite Plate for Crystal Cleansing | Pack of 1,AURA-COLOR-PLATE-ROUND,59,0,0.07%,0.00%,66,0,0.06%,0.00%,98.44%,0.00%,2,0,3.39%,0.00%,₹598.00,₹0.00,2,0
B0F9X4R5SP,B0F9X4R5SP,BRONGS Brass Eagle Statue | Height - 15 cm Aprrox | Weight - 550 Gram Approx | Vastu Idol for Home and Office | Zonal Placement - SW | Flying Eagle Statue for Vastu |Pack of 1,BG-EAGLE,28,2,0.03%,0.06%,38,5,0.03%,0.10%,100.00%,100.00%,3,0,10.71%,0.00%,"₹2,847.00",₹0.00,2,0
B0F9X558DD,B0F9X558DD,BRONGS Brass Nandi Statue | Height - 11 cm Aprrox. | Weight - 810 Gram Approx | Vastu Idol for Home and Office | Zonal Placement - SW | Nandi Idol | Pital Ka Nandi Ji,BG-NANDI,203,0,0.25%,0.00%,274,0,0.23%,0.00%,100.00%,0.00%,2,0,0.99%,0.00%,"₹3,170.00",₹0.00,2,0
B0F9X8SZ2T,B0F9X8SZ2T,BRONGS Brass Kuber Statue | Height - 10 cm Aprrox | Weight - 226 Gram Approx | Vastu Idol for Home and Office | Zonal Placement -North | kubera Idol,BG-4-INCH-DHAN-KUBER,20,0,0.02%,0.00%,31,0,0.03%,0.00%,100.00%,0.00%,2,0,10.00%,0.00%,"₹3,418.00",₹0.00,2,0
B0F9X8TKJD,B0F9X8TKJD,BRONGS Brass Inderdev Statue | Height - 15 cm Aprrox. | Weight -1140 Gram Approx. | Vastu Idol for Home and Office | Zonal Placement - East | Indra Dev Idol for Vastu,BG-INDERDEV,12,0,0.01%,0.00%,17,0,0.01%,0.00%,75.00%,0.00%,2,0,16.67%,0.00%,"₹3,831.44",₹0.00,2,0
B0FC6TXPR1,B0FC6TXPR1,"TREE MAISON CORONATING HOMES Crystal Rose Quartz Pencil |Height - 2 to 3 Inch| Reiki Crystal Pencil for Meditation, Aura Cleansing & Spiritual Practices | Home Decor & Gift |",2-3-INCH-ROSE-QUARTZ-PENCIL,12,0,0.01%,0.00%,23,0,0.02%,0.00%,100.00%,0.00%,6,0,50.00%,0.00%,₹852.00,₹0.00,2,0
B0FF9HRXM4,B0FF9HRXM4,"TREE MAISON CORONATING HOMES Amethyst Crystal Chips |500gm | Crystal Stone for Home Decor, Reiki Healing | Natural Healing Stone",AMETHYST-CHIPS-500-GM,11,0,0.01%,0.00%,14,0,0.01%,0.00%,100.00%,0.00%,2,0,18.18%,0.00%,₹568.00,₹0.00,2,0
B0FF9JJVST,B0FF9JJVST,"TREE MAISON CORONATING HOMES Rose Quartz Chips |500gm | Crystal Stone for Home Decor, Reiki Healing | Love & Harmony",ROSE-QUARTZ-CHIPS-500-GM,9,0,0.01%,0.00%,9,0,0.01%,0.00%,100.00%,0.00%,2,0,22.22%,0.00%,₹568.00,₹0.00,2,0
B0FF9NWVT8,B0FF9NWVT8,"TREE MAISON CORONATING HOMES Ruby Zoisite Chips |500gm | Crystal Stone for Home Decor, Reiki Healing | Spiritual Growth",RUBY-ZIOSITE-CHIPS-500-GM,8,0,0.01%,0.00%,9,0,0.01%,0.00%,100.00%,0.00%,2,0,25.00%,0.00%,₹898.00,₹0.00,2,0
B0FF9PGS7V,B0FF9PGS7V,"TREE MAISON CORONATING HOMES Clear Quartz Crystal Chips |500gm | Crystal Stone for Home Decor, Reiki Healing | Amplifying",CLEAR-QUARTZ-CHIPS-500-GM,14,0,0.02%,0.00%,17,0,0.01%,0.00%,100.00%,0.00%,2,0,14.29%,0.00%,₹736.00,₹0.00,2,0
B0FH2CDV3W,B0FH2CDV3W,"BRONGS Rose Quartz Pyramid | 1.3-Inch (33 mm) | Natural Rose Quartz Crystal Pyramid for Love, Emotional Healing, and Harmony | Perfect for Meditation and Gifting | Vastu Remedy",BG-1.5-INCH-ROSE-QUARTZ-PYRAMID,56,2,0.07%,0.06%,71,4,0.06%,0.08%,100.00%,0.00%,2,0,3.57%,0.00%,₹378.00,₹0.00,2,0
B0FH9NG2F4,B0FH9NG2F4,TREE MAISON CORONATING HOMES Orthoceras Kuber Stone Tower | 21 cm Fossil Tower for Financial Abundance | 1.1kg Healing Crystal for Stability & Balance,KUBER-TOWER,28,1,0.03%,0.03%,43,1,0.04%,0.02%,100.00%,100.00%,2,0,7.14%,0.00%,"₹3,798.00",₹0.00,2,0
B0FHH27FRV,B0FHH27FRV,"TREE MAISON CORONATING HOMES Selenite Charging Plate – 3 Inch with 10–20 Gram Raw Pyrite Stone | Selenite Plate for Crystal Charging, Energy Healing & Spiritual Decor",OM-ROUND-PLT-10GM-PYRIT,12,0,0.01%,0.00%,14,0,0.01%,0.00%,100.00%,0.00%,2,0,16.67%,0.00%,₹720.00,₹0.00,2,0
B0FHH2XDKP,B0FHH2XDKP,"TREE MAISON CORONATING HOMES Selenite Charging Plate – 3 Inch with 10–20 Gram Raw Pyrite Stone | Selenite Plate for Crystal Charging, Energy Healing & Spiritual Decor",SHREEYANTRA-ROUND-PLT-10GM-PYRITE,96,3,0.12%,0.09%,131,5,0.11%,0.10%,99.13%,100.00%,2,0,2.08%,0.00%,₹595.72,₹0.00,2,0
B0FHWSNBV2,B0FHWSNBV2,"TREE MAISON CORONATING HOMES Brass Garud Dev | 12.5 CM Approx | Lord Garuda Dev Idol for Protection, Strength & Positive Energy | Lord Vishnu's Divine Vehicle |Pack of 1",PREMIUM-GARUDA-DEV,81,1,0.10%,0.03%,155,2,0.13%,0.04%,100.00%,100.00%,2,0,2.47%,0.00%,"₹4,748.00",₹0.00,2,0
B0FJ1GT59Q,B0FJ1GT59Q,BRONGS Blue Vastu Correction Tape | 3 Inch (72mm) Approx | Length- 20 Meter Approx | Toilet Vastu Remedy | Pack of 1,BG-3-IN-BLUE-TAPE,7,0,0.01%,0.00%,11,0,0.01%,0.00%,100.00%,0.00%,2,0,28.57%,0.00%,₹525.96,₹0.00,2,0
B0FKZ541V8,B0FKZ541V8,"BRONGS Vastu Shakti Chakra | 7 Inch | Featuring 45 Devtas, 16 Attributes, Health Chart, for vaastu Shashtra Remedy (Acrylic)",7''-SC-04,550,18,0.67%,0.56%,744,25,0.62%,0.52%,98.64%,100.00%,2,0,0.36%,0.00%,₹498.00,₹0.00,2,0
B0FPCD61G1,B0FPCD61G1,BRONGS Brown Dowsing Board with Brass Pendulum(6 INCH) | Metaphysical Message Board for Witchcraft | Pendulum Dowsing Board (Dark Brown Board),BG-D.BROWN-BOARD-6IN,35,1,0.04%,0.03%,46,1,0.04%,0.02%,100.00%,0.00%,2,0,5.71%,0.00%,₹647.00,₹0.00,2,0
B0FPWZVTKC,B0FPWZVTKC,BRONGS Yellow Vastu Correction Tape | 2 Inch (48mm) Approx | Length- 20 Meter Approx | Toilet Vastu Remedy | Pack of 1,BG-2-IN-YELLOW-TAPE,7,1,0.01%,0.03%,7,1,0.01%,0.02%,100.00%,0.00%,2,0,28.57%,0.00%,₹454.00,₹0.00,2,0
B0FRG5HV7H,B0FRG5HV7H,"TREE MAISON CORONATING HOMES Pure Copper Hollow Plain Pyramid | 3 inch Approx |Weight - 26gm Approx Pack of 1 |Boost Positive Energy for Vastu |Energy for Vibrations at Home, Office",3IN-COPPER-HLW-PLN-PYRAMID-ST-1,14,0,0.02%,0.00%,17,0,0.01%,0.00%,93.75%,0.00%,4,1,28.57%,0.00%,"₹1,885.14",₹474.00,2,1
B0FRGGBKGP,B0FRGGBKGP,TREE MAISON CORONATING HOMES Vastu Waterfall Painting Frame for Prosperity & Positive Energy |Size- 12Inch× 18Inch |Weight 1110gm Approx |Wall Décor for Home & Office |Pack Of 1,WATERFALL-POSTER-WITH-FRAME,49,1,0.06%,0.03%,68,1,0.06%,0.02%,100.00%,100.00%,2,0,4.08%,0.00%,"₹1,708.00",₹0.00,2,0
B0FV8P66YR,B0FV8P66YR,BRONGS Brass Direction Swastik Helix | 6 Inches Approx | Door Entrance | Brass Swastik Helix | Vastu Correction Remedies | Positive Energy | Home & Office | Pack of 1 |,BG-6-IN-SWASTIK-BRASS-DIRECTION-HELIX,108,0,0.13%,0.00%,165,0,0.14%,0.00%,100.00%,0.00%,3,0,2.78%,0.00%,"₹2,097.00",₹0.00,2,0
