(Parent) ASIN,(Child) ASIN,Title,SKU,Sessions - Total,Sessions - Total - B2B,Session Percentage - Total,Session Percentage - Total - B2B,Page Views - Total,Page Views - Total - B2B,Page Views Percentage - Total,Page Views Percentage - Total - B2B,Featured Offer Percentage,Featured Offer Percentage - B2B,Units Ordered,Units Ordered - B2B,Unit Session Percentage,Unit Session Percentage - B2B,Ordered Product Sales,Ordered Product Sales - B2B,Total Order Items,Total Order Items - B2B
B0DGGW26HN,B0DGGW26HN,TREE MAISON CORONATING HOMES Vastu Acrylic Vedic Shakti Chakra with Seven Chakra Pendulum | 6 Inch | Health Chart | Vastu Shakti Chakra | Grid Map | Vastu Chakra | Vastu Shakti Chakra Remedy,VEDIC-S.C-6IN-CRY-PENDULUM,81,4,0.10%,0.12%,122,8,0.10%,0.17%,96.00%,100.00%,6,0,7.41%,0.00%,"₹2,214.00",₹0.00,6,0
B0DYK3LCMY,B0DYK3LCMY,"TREE MAISON CORONATING HOMES Vastu Copper 3 Layer Pyramid | Pure Copper Vastu Remedy | 2-Inch | Pyramid for Positive Energy, Health & Wealth | Vastu Dosh Remedies for Home & Office | Pack of 1",2IN-3-LAYER-COPPER-PYRAMID,99,5,0.12%,0.15%,136,8,0.11%,0.17%,100.00%,100.00%,8,1,8.08%,20.00%,"₹7,990.00",₹997.00,6,1
B0F2TD6DSD,B0F2TD6DSD,TREE MAISON CORONATING HOMES Lead Plain Helix | 4 Inch | Energy Booster Vastu Remedy | Vastu Helix Remedy for Zone Correction | Zonal Placement - SW | Pack of 3,4IN-LEAD-PLAIN-HELIX-SET-3,51,3,0.06%,0.09%,83,3,0.07%,0.06%,100.00%,0.00%,10,0,19.61%,0.00%,"₹7,600.00",₹0.00,6,0
B0F91N492Q,B0F91N492Q,TREE MAISON CORONATING HOMES Selenite Crystal Charging Plate | 3 Inch Approx |Selenite Plate to Charge Reiki Crystal |Selenite Plate for Crystal Cleansing | Pack of 1,7CHAKRA-HINDI-SQUARE-PLATE,91,0,0.11%,0.00%,109,0,0.09%,0.00%,97.06%,0.00%,6,0,6.59%,0.00%,"₹1,692.00",₹0.00,6,0
B0F91SZ98Y,B0F91SZ98Y,TREE MAISON CORONATING HOMES Selenite Crystal Charging Plate | 3 Inch Approx |Selenite Plate to Charge Reiki Crystal |Selenite Plate for Crystal Cleansing | Pack of 1,7-CHAKRA-FLOWER-ROUND-PLATE,86,1,0.11%,0.03%,110,2,0.09%,0.04%,98.08%,100.00%,6,0,6.98%,0.00%,"₹1,794.00",₹0.00,6,0
B0FCFB6MH6,B0FCFB6MH6,TREE MAISON CORONATING HOMES Vastu Yellow Vase | Height - 37 Cm | Weight - 800 gm | Decorative Vase | Showpiece for Home & Office | Vastu Decoration Item for Living Room Office |,37-CM-YELLOW-VASE,110,11,0.13%,0.34%,155,18,0.13%,0.37%,100.00%,100.00%,12,5,10.91%,45.45%,"₹10,621.00","₹5,187.00",6,3
B0FJ1MM846,B0FJ1MM846,BRONGS Green Vastu Correction Tape | 3 Inch (72mm) Approx | Length- 20 Meter Approx | Toilet Vastu Remedy | Pack of 1,BG-3-IN-GREEN-TAPE,53,1,0.06%,0.03%,94,1,0.08%,0.02%,97.62%,100.00%,6,1,11.32%,100.00%,"₹1,588.38",₹265.00,6,1
B0FW596KR9,B0FW596KR9,BRONGS Brass Dhanvantri Statue | Height - 13 cm Aprrox. | Weight - 160 Gram Approx. | Vastu Idol for Home and Office |Perfect for Vastu Remedy & Gift | Zonal Placement - NNE |Pack of 1,BG-13CM-DHANVANTRI-STATUE,165,2,0.20%,0.06%,300,5,0.25%,0.10%,100.00%,100.00%,6,0,3.64%,0.00%,"₹7,974.00",₹0.00,6,0
B0GFDLYDL6,B0GFDLYDL6,TREE MAISON CORONATING HOMES Vastu Brass Coin |Weight-30GM (Each PCS) Approx | Vastu Remedy | Brass Coin for Balancing | Pack of 5,BRASS-COINS-SET-5,50,1,0.06%,0.03%,67,1,0.06%,0.02%,100.00%,100.00%,9,0,18.00%,0.00%,"₹7,686.00",₹0.00,6,0
B0GN23512W,B0GN23512W,TREE MAISON CORONATING HOMES Selenite Golden Shree Yantra Crystal Charging Plate | 3 Inch Approx | Selenite Plate to Charge Reiki Crystal | Spiritual Gifts for Healing,GOLDEN-SHREEYANTRA-SQUARE-SELENITE-PLATE,65,3,0.08%,0.09%,85,6,0.07%,0.12%,100.00%,100.00%,8,0,12.31%,0.00%,"₹2,520.00",₹0.00,6,0
B092J353VP,B092J353VP,TREE MAISON CORONATING HOMES Vastu Brass Flying Eagle Statue Sculpture Decorative Garuda Statue for Home Decor | Handcrafted Showpiece | Vastu Gift Item | 5 X 8 X 15 CM | 550 Gram Approx | Pack of 1,EAGLE-BRASS-SHOWPIECE-STATUE,84,5,0.10%,0.15%,118,10,0.10%,0.21%,97.87%,100.00%,6,1,7.14%,20.00%,"₹5,992.00",₹997.00,5,1
B095W5KV6D,B095W5KV6D,TREEMAISON Copper Triangular Spring Anti-Clockwise Use to Boost of The Energy Field (Pack of 3) (Approx-5cm),COPER-TRIANGULAR-SPRING-ST3,128,1,0.16%,0.03%,171,1,0.14%,0.02%,100.00%,100.00%,5,0,3.91%,0.00%,"₹1,420.00",₹0.00,5,0
B09G396JG1,B09G396JG1,TREEMAISON Vastu Aluminium Strip | Width- 1 Inch | Thickness - 0.3mm | Length- 8 Feet Approx | Zone Balancing |Toilet Correction | Main Entrance | Aluminium Strip for Vastu | Pack of 3,ALUMINIUM-STRIP-1INCH-ST3,29,0,0.04%,0.00%,37,0,0.03%,0.00%,100.00%,0.00%,5,0,17.24%,0.00%,"₹3,085.00",₹0.00,5,0
B09G39F3NF,B09G39F3NF,TREEMAISON Vastu Aluminium Strip | Width- 1 Inch | Thickness - 0.3mm | Length- 8 Feet Approx | Zone Balancing |Toilet Correction | Main Entrance | Aluminium Strip for Vastu | Pack of 2,ALUMINIUM-STRIP-1INCH-ST2,35,3,0.04%,0.09%,55,3,0.05%,0.06%,97.73%,100.00%,5,1,14.29%,33.33%,"₹2,489.19",₹497.00,5,1
B09NSMHDCM,B09NSMHDCM,TREE MAISON CORONATING HOMES Vastu Combo of Five Color Tapes | Size-2 Inch(48 mm) Approx| Length- 20 Meter (Approx)| Vastu Tape Remedy for Toilet| Vastu Tape for Main Door Entrance | Pack of 5,SET-5-2INCH-TAPE,44,2,0.05%,0.06%,56,3,0.05%,0.06%,100.00%,100.00%,5,1,11.36%,50.00%,"₹3,060.00",₹612.00,5,1
B09SZB6MYC,B09SZB6MYC,"TREE MAISON CORONATING HOMES Vastu Zinc 2 Layer Pyramid |Size- 3Inch |Zinc Vastu Remedy |Pyramid for Positive Energy, Health & Wealth | Vastu Dosh Remedies for Home | North, NNE, NE | Pack of 1",ZINC-2-LAYER-PYRMID-ST1,62,3,0.08%,0.09%,99,4,0.08%,0.08%,100.00%,100.00%,8,0,12.90%,0.00%,"₹4,792.00",₹0.00,5,0
B09YNLHDBX,B09YNLHDBX,TREE MAISON CORONATING HOMES Vastu Helix Brass (Plain) | Helix Earth (North-West) | Main Door Entrance & Toilet Dosh Correction | Vastu Dosh Nivaran Remedies (4-inch) | Pack of 3,4-INCH-PLAIN-BRASS-HELIX-ST3,16,1,0.02%,0.03%,22,1,0.02%,0.02%,100.00%,100.00%,5,1,31.25%,100.00%,"₹7,975.00","₹1,595.00",5,1
B0BCGNYM2Z,B0BCGNYM2Z,TREE MAISON CORONATING HOMES Vastu 3 Layer Plastic Red Pyramid | Vastu Remedy | Moulded Multi-Layer Pyramid | Pack of 1,3LAYER-PLASTIC-PYRAMID-RED,57,1,0.07%,0.03%,74,2,0.06%,0.04%,100.00%,100.00%,5,0,8.77%,0.00%,"₹1,420.00",₹0.00,5,0
B0CDM3TV2G,B0CDM3TV2G,TREE MAISON CORONATING HOMES Vastu Brass Strip | Width- 0.5 Inch | Thickness- 0.2mm | Length- 8 Feet Approx | Vastu Strips for Zone Balancing & Toilet Remedies | Strip Remedy | Pack of 1,LW-0.5INCH-BRASS-ST1,22,1,0.03%,0.03%,28,1,0.02%,0.02%,100.00%,100.00%,8,0,36.36%,0.00%,"₹2,272.00",₹0.00,5,0
B0CLVLJNV4,B0CLVLJNV4,TREE MAISON CORONATING HOMES Vastu Copper Swastik | 6 Inch |Weight-460gm Approx |Satiya Pyramid Door Sign | Vastu Dosh & Nazar Dosh Remedy | Prosperity & Success | Pack of 1,6-INCH-COPPER-SWASTIK,123,7,0.15%,0.22%,186,8,0.16%,0.17%,99.37%,100.00%,5,2,4.07%,28.57%,"₹6,170.00","₹2,468.00",5,2
B0CR48PXDR,B0CR48PXDR,TREE MAISON CORONATING HOMES Vastu Copper Strip | Width- 0.5 Inch | Thickness - 0.2mm | Length- 25 Feet Approx | Zone Balancing |Toilet Correction | Main Entrance | Copper Strip for Vastu | Pack of 1,25FEET-0.5INCH-STRIP-COPPER-SET-1,24,0,0.03%,0.00%,42,0,0.04%,0.00%,94.12%,0.00%,10,0,41.67%,0.00%,"₹7,930.00",₹0.00,5,0
B0CR647MS4,B0CR647MS4,TREE MAISON CORONATING HOMES Vastu Aluminium Strip | Width- 1 Inch | Thickness - 0.2mm | Length- 25 Feet Approx | Vastu Strip for Toilet Correction | Aluminium Strip for Vastu | Pack of 1,25FEET-1INCH-STRIP-ALUMINIUM-ST-1,89,10,0.11%,0.31%,124,16,0.10%,0.33%,98.32%,100.00%,5,0,5.62%,0.00%,"₹2,446.12",₹0.00,5,0
B0CVDS1VXQ,B0CVDS1VXQ,TREE MAISON CORONATING HOMES Brass Eagle Statue | Weight - 550 G Approx | Size-5 X 8 X 15 Cm |Vastu Shastra & Feng Shui Remedies | Home Decor | Showpiece | Vastu Remedy,BRASS-EAGLE-STATUE,116,4,0.14%,0.12%,147,6,0.12%,0.12%,100.00%,100.00%,6,0,5.17%,0.00%,"₹5,787.00",₹0.00,5,0
B0CVDWHFGF,B0CVDWHFGF,TREE MAISON CORONATING HOMES Brass Sun | Brass Surya | Weight - 1156 Gram Approx | 10 Inch Approx | Brass Sun Face Wall Hanging | Home Decor | Sun for Vastu| Sun Idol Face for Positivity,BIG-SUN,120,9,0.15%,0.28%,160,11,0.13%,0.23%,100.00%,100.00%,5,0,4.17%,0.00%,"₹11,870.00",₹0.00,5,0
B0D45P1CRY,B0D45P1CRY,TREE MAISON CORONATING HOMES Crystal 7 Chakra Point Pendulum (1 Pcs) | Seven Chakra Faceted Stone Dowsing Pendulum with Chain Beads for Dowser| Crystal for Reiki Healing,7-CHAKRA-CRYSTAL-PEND,37,3,0.05%,0.09%,53,3,0.04%,0.06%,100.00%,100.00%,5,0,13.51%,0.00%,"₹1,574.54",₹0.00,5,0
B0DGXH7CWP,B0DGXH7CWP,TREE MAISON CORONATING HOMES Selenite Crystal Charging Plate | 3 Inch Approx | Engraved OM Selenite Plate for Crystal Cleansing | Selenite Plate to Charge Reiki | Pack of 1,OM-ROUND-SELENITE-PLATE-4INCH,58,0,0.07%,0.00%,71,0,0.06%,0.00%,100.00%,0.00%,5,0,8.62%,0.00%,"₹1,196.00",₹0.00,5,0
B0DGXJL9XK,B0DGXJL9XK,TREE MAISON CORONATING HOMES Selenite Crystal Charging Plate | 3 Inch Approx | Selenite Plate to Charge Reiki Crystal | Pack of 1,MANDALA-ROUND-SELENITE-PLATE-4INCH,52,0,0.06%,0.00%,58,0,0.05%,0.00%,100.00%,0.00%,5,0,9.62%,0.00%,"₹1,495.00",₹0.00,5,0
B0F5MZTTS4,B0F5MZTTS4,"TREE MAISON CORONATING HOMES Vastu Shakti Chakra | 6 Inch | Featuring 45 Devtas, 16 Attributes, Health Chart, for vaastu Shashtra Remedy (Acrylic)",RED-SHAKTICHAKRA-6IN,64,1,0.08%,0.03%,89,1,0.07%,0.02%,98.63%,100.00%,6,0,9.38%,0.00%,"₹1,608.00",₹0.00,5,0
B0F944YXC4,B0F944YXC4,BRONGS Brass Dowsing L- Rods Pair |Diameter-5 MM | Set of Board & Brass Pendulum| Aura Energy Checker | Finding Underground Water & Geopathic Stress | Dowser | Pendulum Assorted,5MM-BRASS-DOWSING-HANDLE-ROD,100,4,0.12%,0.12%,152,6,0.13%,0.12%,100.00%,100.00%,5,0,5.00%,0.00%,"₹4,995.00",₹0.00,5,0
B0FBMFBSLN,B0FBMFBSLN,TREE MAISON CORONATING HOMES Selenite Crystal Charging Plate | 3 Inch Approx |Selenite Plate to Charge Reiki Crystal |Selenite Plate for Crystal Cleansing | Pack of 1,SHREEYANTRA-COLOR-SQUARE-PLATE,45,3,0.06%,0.09%,62,4,0.05%,0.08%,100.00%,100.00%,5,1,11.11%,33.33%,"₹1,495.00",₹299.00,5,1
B0FKZ541V8,B0FKZ541V8,"BRONGS Vastu Shakti Chakra | 7 Inch | Featuring 45 Devtas, 16 Attributes, Health Chart, for vaastu Shashtra Remedy (Acrylic)",BG-7-IN-SHAKTI-CHAKRA-04,550,18,0.67%,0.56%,744,25,0.62%,0.52%,98.64%,100.00%,5,0,0.91%,0.00%,"₹1,420.00",₹0.00,5,0
B0FPX1HC69,B0FPX1HC69,BRONGS Red Vastu Correction Tape | 1 Inch (24mm) Approx | Length- 20 Meter Approx | Toilet Vastu Remedy | Pack of 1,BG-1-IN-RED-TAPE,29,0,0.04%,0.00%,40,0,0.03%,0.00%,100.00%,0.00%,5,0,17.24%,0.00%,₹945.00,₹0.00,5,0
B0G5X8LKM2,B0G5X8LKM2,BRONGS Brass 9 Pyramid Strip |Size- 7Inch |Weight of 1 Pyramid Strip- 104gm Approx |Vastu Remedy Tool |Strip with Pyramid Design for Correcting Corner | Home & Spritual Decor | Pack of 3,BG-9-PYR-STRIP-BRASS-7IN-ST-3,36,3,0.04%,0.09%,50,3,0.04%,0.06%,100.00%,100.00%,6,0,16.67%,0.00%,"₹5,694.00",₹0.00,5,0
B08PRVTJQQ,B08PRVTJQQ,Shubh Sanket Vastu Iron Stud (Mahavastu Remedies) 3 inches (Set of 9),IRON-STUD-3INCH-ST9,23,3,0.03%,0.09%,30,3,0.03%,0.06%,100.00%,100.00%,10,0,43.48%,0.00%,"₹3,680.00",₹0.00,4,0
B08XLZWG71,B08XLZWG71,Treemaison Vastu White - Yellow Tape |Size - 4 Inch | Length- 10 Feet (Approx) |Vastu Tape Remedy for Toilet | Vastu Tape for Main Door Entrance | Pack of 2,VINYL-TAPE-WHITE-YELLOW-3-4-INCH,42,1,0.05%,0.03%,60,5,0.05%,0.10%,100.00%,100.00%,5,2,11.90%,200.00%,"₹1,280.00",₹512.00,4,1
B08XVMF9DV,B08XVMF9DV,"TREEMAISON Tree Maison Coronating Homes Vastu Color Tapes, Vastu Tape (4Inch,20 Meter Approx) Pack-5, Multicolor",VASTU-TAPE-BIG-SET-5,62,1,0.08%,0.03%,92,5,0.08%,0.10%,98.75%,0.00%,4,1,6.45%,100.00%,"₹4,556.00","₹1,139.00",4,1
B091YNLS83,B091YNLS83,TREEMAISON Vastu Combo of White-Green Color Tape |Size - 4 Inch| Length- 10 Feet (Approx) |Vastu Remedy for Toilet | Main Door Entrance | Tape Remedy | (Pack of 2),GREEN-WHITE-SMALL-TAPE-VINYL,21,0,0.03%,0.00%,27,0,0.02%,0.00%,100.00%,0.00%,4,0,19.05%,0.00%,"₹1,024.00",₹0.00,4,0
B0999KKST4,B0999KKST4,"Treemaison Village Scene Painting with Frame (Black, 17 Inch x 13 Inch)",VASTU-VILLAGE-PAINTING-WITH-FRAME-BLK,46,2,0.06%,0.06%,62,2,0.05%,0.04%,100.00%,100.00%,4,0,8.70%,0.00%,"₹3,284.00",₹0.00,4,0
B09G38L78V,B09G38L78V,TREEMAISON Iron Strip for Vastu Remedy | Width-0.5 Inch | Thickness - 0.3mm | Length-8 Feet Approx | Vastu Strips for Toilet Correction | Iron Strip for Vastu (Pack of 1),NEW-IRON-STRIP-0.5-ST1,50,3,0.06%,0.09%,70,3,0.06%,0.06%,100.00%,100.00%,6,0,12.00%,0.00%,"₹1,362.00",₹0.00,4,0
B09G39GYT3,B09G39GYT3,TREEMAISON Vastu Brass Strip | Width- 0.5 Inch | Thickness - 0.3mm | Length- 8 Feet Approx |Vastu Strips for Zone Balancing & Toilet Remedies | Main Entrance | Brass Strip for Vastu | Pack of 1,NW-BRASS-STRIP-0.5-ST1,33,1,0.04%,0.03%,49,1,0.04%,0.02%,95.65%,100.00%,4,1,12.12%,100.00%,"₹1,309.00",₹330.00,4,1
B09MJ422MM,B09MJ422MM,TREEMAISON Brass Deer Statue | Weight -270 Gram Approx | Vastu Shastra & Feng Shui Remedies | Home Decor | Vastu Remedy | Pack of 1,BRASS-BIG-DEER-SET1,40,0,0.05%,0.00%,57,0,0.05%,0.00%,100.00%,0.00%,4,0,10.00%,0.00%,"₹3,596.00",₹0.00,4,0
B09MJ7B11P,B09MJ7B11P,TREE MAISON CORONATING HOMES Brass Lion Statue | Weight - 762 G (Approx) | Size-5 Inch | Vastu Remedy | Zonal Placement -North-North-East | Lion Statue for Home Decor | Showpiece,BRASS-LION-SET1,110,6,0.13%,0.19%,146,7,0.12%,0.15%,99.22%,100.00%,4,0,3.64%,0.00%,"₹6,076.00",₹0.00,4,0
B09NPYT87M,B09NPYT87M,"BRONGS Brass Strip | 0.75 INCH | Pack of 2 | Brass Strip for Vastu | Strip for Toilet Correction | Vastu Strip Remedy | Width-18mm, Thickness-0.3mm, Length-8 Feet Approx",VAASTU-BRASS-STRIP-0.75-INCH-ST2,67,5,0.08%,0.15%,105,5,0.09%,0.10%,97.89%,100.00%,4,2,5.97%,40.00%,"₹2,394.00","₹1,196.00",4,2
B09NPZQL1H,B09NPZQL1H,"BRONGS Brass Strip | 1 INCH | Pack of 2 | Vastu Brass Strip for Toilet | Vastu Strip Remedy | Width-25mm, Thickness-0.3mm, Length-8 Feet Approx",BRNGS-BRASS-STRIP-ST2,98,8,0.12%,0.25%,127,9,0.11%,0.19%,99.12%,100.00%,10,0,10.20%,0.00%,"₹8,490.00",₹0.00,4,0
B09NSMS3PL,B09NSMS3PL,TREE MAISON CORONATING HOMES Vastu White Tape |Size - 2 Inch (48 mm) | Length- 20 Meter (Approx) | Vastu Tape Remedy for Toilet | Vastu Tape for Main Door Entrance | Pack of 1,2-INCH-VASTU-TAPE-WHITE-ST1,16,1,0.02%,0.03%,19,1,0.02%,0.02%,100.00%,0.00%,4,0,25.00%,0.00%,₹908.00,₹0.00,4,0
B09WDGN29B,B09WDGN29B,"TREE MAISON CORONATING HOMES Vastu Black Coil Round Anti-Clockwise Spring for North, North East Direction Used to Enhance The Energy of Water Element 1.5"" Inch (Pack of 3)",BLACK-ACW-SPRING-ST3,12,0,0.01%,0.00%,14,0,0.01%,0.00%,100.00%,0.00%,5,0,41.67%,0.00%,"₹1,136.00",₹0.00,4,0
B09YNLFC5G,B09YNLFC5G,TREE MAISON CORONATING HOMES Vastu Helix Brass (Plain) | Vastu Helix (North-West) | Main Door Entrance & Toilet Dosh Correction | Vastu Dosh Nivaran Remedies (4-inch) | Pack of 1,4-INCH-PLAIN-BRASS-HELIX-ST1,20,0,0.02%,0.00%,40,0,0.03%,0.00%,100.00%,0.00%,4,0,20.00%,0.00%,"₹2,196.00",₹0.00,4,0
B0B77622F6,B0B77622F6,TREE MAISON CORONATING HOMES Vastu Combo of Five Color Tapes | Size - 3 Inch (72 mm) Approx | Length- 20 Meter (Approx) | Vastu Tape Remedy for Toilet | Vastu Tape for Main Door Entrance | Pack of 5,3-INCH-TAPE-SET-5-merchant,447,26,0.55%,0.80%,604,35,0.51%,0.73%,100.00%,100.00%,4,0,0.89%,0.00%,"₹3,892.95",₹0.00,4,0
B0BJ21Y3NV,B0BJ21Y3NV,TREE MAISON CORONATING HOMES Brass Vaastu Tortoise | Turtle | Weight - 590 Gram Approx | Kachua | Feng Shui | Vastu Shastra Remedies | Home Decor | Turtle for Good Luck | Pack of 1,SMALL-BRASS-TURTLE,54,2,0.07%,0.06%,89,3,0.07%,0.06%,100.00%,100.00%,4,1,7.41%,50.00%,"₹3,994.00",₹997.00,4,1
B0BR877RKM,B0BR877RKM,TREE MAISON CORONATING HOMES Vastu Zinc Helix for Vastu Remedy | Vastu Remedies for Toilet - Door | Zone Correction | Vastu Dosh Nivaran Remedies | Size- 4 Inch Approx | Pack of 3,4INCH-ZINC-HELIX-ST-3,27,1,0.03%,0.03%,56,1,0.05%,0.02%,100.00%,100.00%,6,0,22.22%,0.00%,"₹5,010.00",₹0.00,4,0
B0C466V312,B0C466V312,TREE MAISON CORONATING HOMES Vastu Star Dowsing Board | 6inch | Metaphysical Message Board for Witchcraft with Brass (Pendulum Assorted) Acrylic Divination.,BLACK-BOARD+PENDULUM,125,2,0.15%,0.06%,157,5,0.13%,0.10%,100.00%,100.00%,4,0,3.20%,0.00%,"₹1,311.00",₹0.00,4,0
B0C718LWNQ,B0C718LWNQ,"TREEMAISON Brass Dhanvantri Statue/Idol for Vastu Shastra and Feng Shui Remedies for Home Decor Statue/SHOWPEICE Product Decorative Items/VASTU Remedy, 7 x 7 Cm",BRASS-DHANVANTRI,138,3,0.17%,0.09%,191,3,0.16%,0.06%,100.00%,100.00%,4,0,2.90%,0.00%,"₹7,596.00",₹0.00,4,0
B0C7MZ1FZ3,B0C7MZ1FZ3,"TREE MAISON CORONATING HOMES Vastu Iron Strip | 1 INCH | Pack of 1 | Iron Strip for Vastu | Vastu Strip Remedy | Width-25mm, Thickness-1 mm, Length-8 Feet Approx",IRON-STRIP-1MM-.COM,58,1,0.07%,0.03%,106,1,0.09%,0.02%,100.00%,0.00%,4,0,6.90%,0.00%,"₹1,860.00",₹0.00,4,0
B0C8ZDSCHS,B0C8ZDSCHS,"TREE MAISON CORONATING HOMES Iron Strip | 0.5 INCH | Pack of 2 | Iron Strip for Vastu | Vastu Strip Remedy | Width-12mm, Thickness-0.3mm, Length-8 Feet Approx",0.5IN-IRON-STRIP-ST2-.COM,29,0,0.04%,0.00%,37,0,0.03%,0.00%,100.00%,0.00%,7,0,24.14%,0.00%,"₹1,988.00",₹0.00,4,0
B0CHMFLPWR,B0CHMFLPWR,TREE MAISON CORONATING HOMES Pure Copper Coin |Weight- 30gm(Each Coins) Approx | Vastu Remedy | Copper Coin for Balancing The Fire Zone | Pack of 11,COPPER-COINS-ST11,58,2,0.07%,0.06%,73,2,0.06%,0.04%,100.00%,0.00%,4,1,6.90%,50.00%,"₹7,596.00","₹1,899.00",4,1
B0CMCJ8CLK,B0CMCJ8CLK,TREE MAISON CORONATING HOMES Brass Deer Statue | Weight - 840 Gram Approx | Figurine | Designer Deer | Vastu Brass Showpeice for Home & Office | Pital Hiran | Size - 9 Inch Approx,BIG-DEER-ST!,107,3,0.13%,0.09%,171,7,0.14%,0.15%,100.00%,100.00%,4,0,3.74%,0.00%,"₹6,536.00",₹0.00,4,0
B0CNXR8M61,B0CNXR8M61,TREE MAISON CORONATING HOMES Vastu Sun & Moon Dowsing Board | 6 Inch | with Brass Pendulum (Pendulum Assorted) Acrylic Divination Board,SUN-PENDULUM-BOARD,68,1,0.08%,0.03%,77,1,0.06%,0.02%,100.00%,100.00%,4,0,5.88%,0.00%,"₹1,311.00",₹0.00,4,0
B0CR488NNG,B0CR488NNG,TREE MAISON CORONATING HOMES Vastu Aluminium Strip | Width- 0.5 Inch | Thickness - 0.2mm | Length- 25 Feet Approx | Strip for Entrance & Toilet Correction | Aluminium Strip for Vastu | Pack of 1,25FEET-0.5INCH-STRIP-ALUMINIUM-SET-1,31,1,0.04%,0.03%,45,2,0.04%,0.04%,100.00%,100.00%,8,0,25.81%,0.00%,"₹3,992.00",₹0.00,4,0
B0CR48PXDR,B0CR48PXDR,TREE MAISON CORONATING HOMES Vastu Copper Strip | Width- 0.5 Inch | Thickness - 0.2mm | Length- 25 Feet Approx | Zone Balancing |Toilet Correction | Main Entrance | Copper Strip for Vastu | Pack of 1,25FEET-0.5INCH-COPPER-STRIP-SET-1,24,0,0.03%,0.00%,42,0,0.04%,0.00%,94.12%,0.00%,9,0,37.50%,0.00%,"₹6,980.55",₹0.00,4,0
B0CR62DK9S,B0CR62DK9S,TREE MAISON CORONATING HOMES Vastu Stainless Steel Strip | Width- 1 Inch | Thickness - 0.2mm | Length- 4 Feet Approx | Strip for Entrance & Toilet Correction | Steel Strip for Vastu | Pack of 1,4FEET-STRIP-1INCH-S.S-SET-1,34,4,0.04%,0.12%,45,4,0.04%,0.08%,100.00%,100.00%,4,0,11.76%,0.00%,₹872.00,₹0.00,4,0
B0CR62YRNS,B0CR62YRNS,TREE MAISON CORONATING HOMES Vastu Stainless Steel Strip | Width-1 Inch | Thickness - 0.2mm | Length-12 Feet Approx | Zone Balancing | Toilet Correction | Steel Strip for Vastu | Pack of 1,12FEET-1INCH-STRIP-S.S-SET-1,29,2,0.04%,0.06%,40,3,0.03%,0.06%,100.00%,100.00%,5,0,17.24%,0.00%,"₹2,365.00",₹0.00,4,0
B0CTFHTZWD,B0CTFHTZWD,"TREE MAISON CORONATING HOMES Vastu Acrylic Shakti Chakra |Size- 9 Inch | Without Colour Featuring 45 Devtas, 16 Attributes, Health Chart, Rajas, Sattav, Tamas for vaastu Shashtra Remedy",VASTU-9INCH-SHAKTI-CHAKRA-02,30,1,0.04%,0.03%,47,1,0.04%,0.02%,100.00%,100.00%,4,0,13.33%,0.00%,"₹1,586.00",₹0.00,4,0
B0CTFJQD5P,B0CTFJQD5P,"TREE MAISON CORONATING HOMES Vastu Acrylic Shakti Chakra | 6 INCH | Without Colour Featuring 45 Devtas, 16 Attributes, Health Chart | Rajas, Sattav, Tamas for vaastu Shashtra Remedy",VASTU-6INCH-SHAKTI-CHAKRA-02,25,0,0.03%,0.00%,47,0,0.04%,0.00%,100.00%,0.00%,4,0,16.00%,0.00%,"₹1,072.00",₹0.00,4,0
B0D1KLLW73,B0D1KLLW73,TREE MAISON CORONATING HOMES Acrylic Black Seven Star Dowsing Board 6 Inch with Crystal Seven Chakra Pendulum | Metaphysical Message Board for Witchcraft | Witch Board | Pendulum Dowsing Board,7STAR-BOARD-6INCH+CRYS-PEND,41,1,0.05%,0.03%,59,1,0.05%,0.02%,100.00%,100.00%,4,0,9.76%,0.00%,"₹1,536.00",₹0.00,4,0
B0D9S1HMZP,B0D9S1HMZP,TREEMAISON Vastu Red Tape | Size - 2 Inch (48 mm) Approx | Length- 20 Meter (Approx) | Vastu Tape Remedy for Toilet | Vastu Tape for Main Door Entrance | Tape Remedy | Pack of 1,2-INCH-RED-TAPE,22,2,0.03%,0.06%,31,2,0.03%,0.04%,100.00%,100.00%,4,1,18.18%,50.00%,₹908.00,₹227.00,4,1
B0D9W8L485,B0D9W8L485,TREE MAISON CORONATING HOMES Vastu Green - White Tape | Size - 3 Inch (72 mm) Approx | Length- 20 Meter (Approx) | Vastu Tape Remedy for Toilet | Vastu Tape for Main Door | Tape Remedy | Pack of 2,GREEN-WHITE-3INCH-TAPE,17,0,0.02%,0.00%,25,0,0.02%,0.00%,100.00%,0.00%,4,0,23.53%,0.00%,"₹1,996.00",₹0.00,4,0
B0DF2VS1P2,B0DF2VS1P2,"TREEMAISON Vastu Acrylic Shakti Chakra | Size- 6 Inch | Featuring 45 Devtas, 16 Attributes | Health Chart | Rajas, Sattav, Tamas for Maha-vaastu Shashtra Remedy (Hindi)",HINDI-SHAKTI-CHAKRA-AB,63,2,0.08%,0.06%,107,3,0.09%,0.06%,98.80%,100.00%,4,0,6.35%,0.00%,"₹1,069.96",₹0.00,4,0
B0DSJFN7PB,B0DSJFN7PB,"TREE MAISON CORONATING HOMES Vastu Brass Virtual Rod | 12-Inch |Weight- 980gm Approx |Virtual Entry Rod for Wealth, Prosperity & Success | Size: 12 Inch x 2.2cm | Pack of 1",12IN-BRASS-VIRTUAL-ROD-ST1,40,2,0.05%,0.06%,54,2,0.05%,0.04%,100.00%,100.00%,6,0,15.00%,0.00%,"₹9,570.00",₹0.00,4,0
B0F2TB4R14,B0F2TB4R14,TREE MAISON CORONATING HOMES Copper Hii Helix | 4 Inch | Energy Booster Vastu Remedy | Vastu Helix Remedy for Zone Correction | Zonal Placement - SE | Pack of 1,4IN-COPPER-HII-HELIX-SET-1,34,3,0.04%,0.09%,46,4,0.04%,0.08%,100.00%,100.00%,11,0,32.35%,0.00%,"₹6,589.00",₹0.00,4,0
B0F91RVVJN,B0F91RVVJN,TREE MAISON CORONATING HOMES Selenite Crystal Charging Plate | 3 Inch Approx |Selenite Plate to Charge Reiki Crystal |Selenite Plate for Crystal Cleansing | Pack of 1,SHREEYANTRA-BLUE-SQUARE-PLATE,53,0,0.06%,0.00%,68,0,0.06%,0.00%,98.44%,0.00%,4,0,7.55%,0.00%,₹846.00,₹0.00,4,0
B0F9X6HSS2,B0F9X6HSS2,BRONGS Brass Deer Statue | Height - 22 cm Aprrox | Weight - 840 Gram Approx | Vastu Idol for Home and Office | Zonal Placement - West/WNW | Deer Showpiece for Home Decoration,BG-BIG-DEER,50,2,0.06%,0.06%,79,2,0.07%,0.04%,100.00%,100.00%,5,0,10.00%,0.00%,"₹8,706.24",₹0.00,4,0
B0F9X72FWQ,B0F9X72FWQ,BRONGS Brass Natraj Statue | Height - 21 cm Aprrox. | Weight - 1014 Gram Approx | Vastu Idol for Home and Office | Zonal Placement - E/NW | Natraj Idol | Natraj Murti,BG-NATRAJ,250,6,0.31%,0.19%,396,10,0.33%,0.21%,99.70%,100.00%,6,0,2.40%,0.00%,"₹10,824.00",₹0.00,4,0
B0FDBF4SQV,B0FDBF4SQV,"BRONGS Natural White Mica Powder (Muscovite) | Mica Crystal Powder for Healing, Energy Work, Meditation & Home Decor | Spiritual Vastu Powder |Pack of 100gm",BG-MUSCOVITE-POWDER-100GRAM,40,1,0.05%,0.03%,48,1,0.04%,0.02%,100.00%,0.00%,4,0,10.00%,0.00%,"₹1,136.00",₹0.00,4,0
B0FF9J27VK,B0FF9J27VK,"TREE MAISON CORONATING HOMES Rainbow Moonstone Crystal Chips |100gm | Crystal Rough Stone for Home Decor, Reiki Healing | Intuition",MOONSTONE-CHIPS-100-GM,26,0,0.03%,0.00%,35,0,0.03%,0.00%,100.00%,0.00%,4,0,15.38%,0.00%,₹756.00,₹0.00,4,0
B0FH2F2PS1,B0FH2F2PS1,"BRONGS 7 Chakra Tumble Stones | Chakra Balancing Crystal Set for Meditation, Reiki & Energy Healing | Elegant Spiritual Gift Set",BG-7-CHAKRA-TUMBLE,168,5,0.21%,0.15%,259,10,0.22%,0.21%,100.00%,100.00%,4,0,2.38%,0.00%,"₹1,196.00",₹0.00,4,0
B0FH2F7PTL,B0FH2F7PTL,"BRONGS Peridot Pyramid | 1.3-Inch (33 mm) | Natural Peridot Crystal Pyramid for Abundance, Emotional Healing, and Positive Energy|Perfect for Meditation and Decor",BG-1.5-INCH-PERIDOT-PYRAMID,114,7,0.14%,0.22%,153,7,0.13%,0.15%,100.00%,100.00%,6,0,5.26%,0.00%,"₹1,134.00",₹0.00,4,0
B0FH2FS266,B0FH2FS266,"BRONGS Amethyst Pyramid | 1.3-Inch (33 mm) | Natural Amethyst Crystal Pyramid for Calmness, Meditation, and Spiritual Healing|Perfect for Home Decor and Gifting",BG-1.5-INCH-AMETHYST-PYRAMID,52,1,0.06%,0.03%,69,1,0.06%,0.02%,100.00%,0.00%,4,0,7.69%,0.00%,₹756.00,₹0.00,4,0
B0G5XDF6PY,B0G5XDF6PY,BRONGS Copper 9 Pyramid Strip |Size- 7Inch |Weight of 1 Pyramid Strip - 110gm Approx |Vastu Remedy Tool |Angle Strip with Pyramid Design for Correcting Corner | Home & Spritual Decor |Pack of 3,BG-9-PYR-STRIP-COPPER-7IN-ST-3,29,3,0.04%,0.09%,36,4,0.03%,0.08%,100.00%,100.00%,4,1,13.79%,33.33%,"₹4,936.00","₹1,234.00",4,1
B0G9Q64TXD,B0G9Q64TXD,TREEMAISON CORONATING Homes Vastu Copper Strip | Width- 0.5 Inch | Thickness - 0.5mm | Length- 8 Feet Approx | Zone Balancing |Toilet Correction |Pack of 1,0.5MM-8FT-STRIP-0.5INCH-COPPER-ST-1,37,3,0.05%,0.09%,57,4,0.05%,0.08%,100.00%,100.00%,5,1,13.51%,33.33%,"₹2,370.00",₹474.00,4,1
B0GFD2NNP9,B0GFD2NNP9,"TREE MAISON CORONATING HOMES Copper Shree Yantra |Size-9Inch Approx | Weight-240gm Approx |Laser Cut for Health, Wealth & Prosperity | Wall Hanging (Copper) |Pack of 1",COPPER-LASER-YANTRA-9-INCH-ST-1,60,7,0.07%,0.22%,69,7,0.06%,0.15%,100.00%,100.00%,6,1,10.00%,14.29%,"₹17,094.00","₹2,849.00",4,1
B0GMPHVD8G,B0GMPHVD8G,TREE MAISON CORONATING HOMES Vastu Stainless Steel Strip With Muscovite Chips| Width- 1 Inch | Thickness - 0.2mm | Length- 8 Feet Approx |Steel Strip for Vastu | Pack of 1,MOSCOVITE-0.2MM-8FT-STRIP-1''-S.S-ST1,40,0,0.05%,0.00%,44,0,0.04%,0.00%,100.00%,0.00%,4,0,10.00%,0.00%,"₹1,497.00",₹0.00,4,0
B0GT52TJKP,B0GT52TJKP,TREE MAISON CORONATING HOMES Vastu Brass Hanuman Ji Statue |Size-7.5cm Approx |Weight-136gm Approx |Vastu Remedy for Home & Office |Hanuman Idol for Pooja | Vastu Brass Statue,BRASS-7.5CM-SMALL-HANUMAN-JI-ST-1,37,1,0.05%,0.03%,43,1,0.04%,0.02%,100.00%,0.00%,4,0,10.81%,0.00%,"₹3,996.00",₹0.00,4,0
B08SWJYWBP,B08SWJYWBP,TREEMAISON Vastu White Tape | Size - 4 Inch | Length- 8 Feet (Approx) | Vastu Tape for Toilet | Main Door Entrance | Vastu Tape Remedy | Pack of 1,VINYAL-TAPE-SMALL-WHITE,52,1,0.06%,0.03%,79,2,0.07%,0.04%,100.00%,100.00%,4,0,7.69%,0.00%,₹800.00,₹0.00,3,0
